text,text_squish,text_joined,rank,name,title,first,middle,last,suffix,first_clean,firstlast
AMBASSADOR: John M. Steeves,AMBASSADOR: John M. Steeves,AMBASSADOR: John M. Steeves,AMBASSADOR, John M. Steeves,,John,M.,Steeves,,John,John Steeves
DEPUTY CHIEF OF MISSION: William D. Brewer,DEPUTY CHIEF OF MISSION: William D. Brewer,DEPUTY CHIEF OF MISSION: William D. Brewer,DEPUTY CHIEF OF MISSION, William D. Brewer,,William,D.,Brewer,,William,William Brewer
"POLITICAL SECTION: Howard J. Ashford, Jr.","POLITICAL SECTION: Howard J. Ashford, Jr.","POLITICAL SECTION: Howard J. Ashford, Jr.",POLITICAL SECTION," Howard J. Ashford, Jr.",,Howard,J.,Ashford,Jr.,Howard,Howard Ashford
AID MISSION DIRECTOR: Delmas H. Nucker,AID MISSION DIRECTOR: Delmas H. Nucker,AID MISSION DIRECTOR: Delmas H. Nucker,AID MISSION DIRECTOR, Delmas H. Nucker,,Delmas,H.,Nucker,,Delmas,Delmas Nucker
AMBASSADOR: William J. Porter,AMBASSADOR: William J. Porter,AMBASSADOR: William J. Porter,AMBASSADOR, William J. Porter,,William,J.,Porter,,William,William Porter
DEPUTY CHIEF OF MISSION: John F. Root,DEPUTY CHIEF OF MISSION: John F. Root,DEPUTY CHIEF OF MISSION: John F. Root,DEPUTY CHIEF OF MISSION, John F. Root,,John,F.,Root,,John,John Root
POLITICAL SECTION: Peter R. Chase,POLITICAL SECTION: Peter R. Chase,POLITICAL SECTION: Peter R. Chase,POLITICAL SECTION, Peter R. Chase,,Peter,R.,Chase,,Peter,Peter Chase
"ECONOMIC SECTION: Frederic K. Lundy, Jr.","ECONOMIC SECTION: Frederic K. Lundy, Jr.","ECONOMIC SECTION: Frederic K. Lundy, Jr.",ECONOMIC SECTION," Frederic K. Lundy, Jr.",,Frederic,K.,Lundy,Jr.,Frederic,Frederic Lundy
CONSULATE GENERAL: Luanda,CONSULATE GENERAL: Luanda,CONSULATE GENERAL: Luanda,CONSULATE GENERAL, Luanda,,Luanda,,,,Luanda,Luanda 
CONSUL GENERAL: Henry C. Reed,CONSUL GENERAL: Henry C. Reed,CONSUL GENERAL: Henry C. Reed,CONSUL GENERAL, Henry C. Reed,,Henry,C.,Reed,,Henry,Henry Reed
DEPUTY PRINCIPAL OFFICER: Robert H. Flenner,DEPUTY PRINCIPAL OFFICER: Robert H. Flenner,DEPUTY PRINCIPAL OFFICER: Robert H. Flenner,DEPUTY PRINCIPAL OFFICER, Robert H. Flenner,,Robert,H.,Flenner,,Robert,Robert Flenner
"ECONOMIC SECTION: George T. Colman, Jr.","ECONOMIC SECTION: George T. Colman, Jr.","ECONOMIC SECTION: George T. Colman, Jr.",ECONOMIC SECTION," George T. Colman, Jr.",,George,T.,Colman,Jr.,George,George Colman
AMBASSADOR: Edwin M. Martin,AMBASSADOR: Edwin M. Martin,AMBASSADOR: Edwin M. Martin,AMBASSADOR, Edwin M. Martin,,Edwin,M.,Martin,,Edwin,Edwin Martin
"DEPUTY CHIEF OF MISSION: Charles W. Adair, Jr.","DEPUTY CHIEF OF MISSION: Charles W. Adair, Jr.","DEPUTY CHIEF OF MISSION: Charles W. Adair, Jr.",DEPUTY CHIEF OF MISSION," Charles W. Adair, Jr.",,Charles,W.,Adair,Jr.,Charles,Charles Adair
"POLITICAL SECTION: Ellwood M. Rabenold, Jr.","POLITICAL SECTION: Ellwood M. Rabenold, Jr.","POLITICAL SECTION: Ellwood M. Rabenold, Jr.",POLITICAL SECTION," Ellwood M. Rabenold, Jr.",,Ellwood,M.,Rabenold,Jr.,Ellwood,Ellwood Rabenold
ECONOMIC SECTICN: John Heilman,ECONOMIC SECTICN: John Heilman,ECONOMIC SECTICN: John Heilman,ECONOMIC SECTICN, John Heilman,,John,,Heilman,,John,John Heilman
COMMERCIAL SECTION: John F. Troy,COMMERCIAL SECTION: John F. Troy,COMMERCIAL SECTION: John F. Troy,COMMERCIAL SECTION, John F. Troy,,John,F.,Troy,,John,John Troy
AGRICULTURAL ATTACHE: Quentin R. Bates,AGRICULTURAL ATTACHE: Quentin R. Bates,AGRICULTURAL ATTACHE: Quentin R. Bates,AGRICULTURAL ATTACHE, Quentin R. Bates,,Quentin,R.,Bates,,Quentin,Quentin Bates
DEPUTY CHIEF OF MISSION: Jack W. Lydman,DEPUTY CHIEF OF MISSION: Jack W. Lydman,DEPUTY CHIEF OF MISSION: Jack W. Lydman,DEPUTY CHIEF OF MISSION, Jack W. Lydman,,Jack,W.,Lydman,,Jack,Jack Lydman
POLITICAL SECTION: Doyle V. Martin,POLITICAL SECTION: Doyle V. Martin,POLITICAL SECTION: Doyle V. Martin,POLITICAL SECTION, Doyle V. Martin,,Doyle,V.,Martin,,Doyle,Doyle Martin
ECONOMIC SECTION: Eddie W. Schodt,ECONOMIC SECTION: Eddie W. Schodt,ECONOMIC SECTION: Eddie W. Schodt,ECONOMIC SECTION, Eddie W. Schodt,,Eddie,W.,Schodt,,Eddie,Eddie Schodt
AGRICULTURAL ATTACHE: William L. Rodman,AGRICULTURAL ATTACHE: William L. Rodman,AGRICULTURAL ATTACHE: William L. Rodman,AGRICULTURAL ATTACHE, William L. Rodman,,William,L.,Rodman,,William,William Rodman
CONSULATE GENERAL: Melbourne,CONSULATE GENERAL: Melbourne,CONSULATE GENERAL: Melbourne,CONSULATE GENERAL, Melbourne,,Melbourne,,,,Melbourne,Melbourne 
CONSUL GENERAL: Lincoln White,CONSUL GENERAL: Lincoln White,CONSUL GENERAL: Lincoln White,CONSUL GENERAL, Lincoln White,,Lincoln,,White,,Lincoln,Lincoln White
ECONOMIC SECTION: Norman L. Smith,ECONOMIC SECTION: Norman L. Smith,ECONOMIC SECTION: Norman L. Smith,ECONOMIC SECTION, Norman L. Smith,,Norman,L.,Smith,,Norman,Norman Smith
COMMERCIAL SECTION: Edward C. Howatt,COMMERCIAL SECTION: Edward C. Howatt,COMMERCIAL SECTION: Edward C. Howatt,COMMERCIAL SECTION, Edward C. Howatt,,Edward,C.,Howatt,,Edward,Edward Howatt
CONSULATE GENERAL: Sydney,CONSULATE GENERAL: Sydney,CONSULATE GENERAL: Sydney,CONSULATE GENERAL, Sydney,,Sydney,,,,Sydney,Sydney 
CONSUL GENERAL: Edward A. Bolster,CONSUL GENERAL: Edward A. Bolster,CONSUL GENERAL: Edward A. Bolster,CONSUL GENERAL, Edward A. Bolster,,Edward,A.,Bolster,,Edward,Edward Bolster
COMMERCIAL SECTION: Robert A. Thayer,COMMERCIAL SECTION: Robert A. Thayer,COMMERCIAL SECTION: Robert A. Thayer,COMMERCIAL SECTION, Robert A. Thayer,,Robert,A.,Thayer,,Robert,Robert Thayer
AMBASSADOR: James W. Riddleberger,AMBASSADOR: James W. Riddleberger,AMBASSADOR: James W. Riddleberger,AMBASSADOR, James W. Riddleberger,,James,W.,Riddleberger,,James,James Riddleberger
DEPUTY CHIEF OF MISSION: Robert M. Brandin,DEPUTY CHIEF OF MISSION: Robert M. Brandin,DEPUTY CHIEF OF MISSION: Robert M. Brandin,DEPUTY CHIEF OF MISSION, Robert M. Brandin,,Robert,M.,Brandin,,Robert,Robert Brandin
ECONOMIC SECTION: Clinton L. Olson,ECONOMIC SECTION: Clinton L. Olson,ECONOMIC SECTION: Clinton L. Olson,ECONOMIC SECTION, Clinton L. Olson,,Clinton,L.,Olson,,Clinton,Clinton Olson
COMMERCIAL SECTION: Henry W. Prentice,COMMERCIAL SECTION: Henry W. Prentice,COMMERCIAL SECTION: Henry W. Prentice,COMMERCIAL SECTION, Henry W. Prentice,,Henry,W.,Prentice,,Henry,Henry Prentice
CONSULATE GENERAL: Nassau,CONSULATE GENERAL: Nassau,CONSULATE GENERAL: Nassau,CONSULATE GENERAL, Nassau,,Nassau,,,,Nassau,Nassau 
CONSUL GENERAL: J. Lawrence Barnard,CONSUL GENERAL: J. Lawrence Barnard,CONSUL GENERAL: J. Lawrence Barnard,CONSUL GENERAL, J. Lawrence Barnard,,J.,Lawrence,Barnard,,Lawrence,Lawrence Barnard
AMBASSADOR: Douglas MacArthur II,AMBASSADOR: Douglas MacArthur II,AMBASSADOR: Douglas MacArthur II,AMBASSADOR, Douglas MacArthur II,,Douglas,,MacArthur,II,Douglas,Douglas MacArthur
DEPUTY CHIEF OF MISSION: John M. McSweeney,DEPUTY CHIEF OF MISSION: John M. McSweeney,DEPUTY CHIEF OF MISSION: John M. McSweeney,DEPUTY CHIEF OF MISSION, John M. McSweeney,,John,M.,McSweeney,,John,John McSweeney
POLITICAL SECTION: Robert M. Beaudry,POLITICAL SECTION: Robert M. Beaudry,POLITICAL SECTION: Robert M. Beaudry,POLITICAL SECTION, Robert M. Beaudry,,Robert,M.,Beaudry,,Robert,Robert Beaudry
ECONOMIC SECTION: Chris G. Petrow,ECONOMIC SECTION: Chris G. Petrow,ECONOMIC SECTION: Chris G. Petrow,ECONOMIC SECTION, Chris G. Petrow,,Chris,G.,Petrow,,Chris,Chris Petrow
COMMERCIAL SECTION: E. Paul Hawk,COMMERCIAL SECTION: E. Paul Hawk,COMMERCIAL SECTION: E. Paul Hawk,COMMERCIAL SECTION, E. Paul Hawk,,E.,Paul,Hawk,,Paul,Paul Hawk
AGRICULTURAL ATTACHE: Clayton E. Whipple,AGRICULTURAL ATTACHE: Clayton E. Whipple,AGRICULTURAL ATTACHE: Clayton E. Whipple,AGRICULTURAL ATTACHE, Clayton E. Whipple,,Clayton,E.,Whipple,,Clayton,Clayton Whipple
CONSULATE GENERAL: Antwerp,CONSULATE GENERAL: Antwerp,CONSULATE GENERAL: Antwerp,CONSULATE GENERAL, Antwerp,,Antwerp,,,,Antwerp,Antwerp 
CONSUL GENERAL: Arthur A. Compton,CONSUL GENERAL: Arthur A. Compton,CONSUL GENERAL: Arthur A. Compton,CONSUL GENERAL, Arthur A. Compton,,Arthur,A.,Compton,,Arthur,Arthur Compton
ECONOMIC SECTION: Charles T. Skow,ECONOMIC SECTION: Charles T. Skow,ECONOMIC SECTION: Charles T. Skow,ECONOMIC SECTION, Charles T. Skow,,Charles,T.,Skow,,Charles,Charles Skow
COMMERCIAL SECTION: Leslie A. Klieforth,COMMERCIAL SECTION: Leslie A. Klieforth,COMMERCIAL SECTION: Leslie A. Klieforth,COMMERCIAL SECTION, Leslie A. Klieforth,,Leslie,A.,Klieforth,,Leslie,Leslie Klieforth
CONSULATE GENERAL: Hamilton,CONSULATE GENERAL: Hamilton,CONSULATE GENERAL: Hamilton,CONSULATE GENERAL, Hamilton,,Hamilton,,,,Hamilton,Hamilton 
CONSUL GENERAL: George W. Renchard,CONSUL GENERAL: George W. Renchard,CONSUL GENERAL: George W. Renchard,CONSUL GENERAL, George W. Renchard,,George,W.,Renchard,,George,George Renchard
"ECONOMIC SECTION: Samuel M. Janney, Jr.","ECONOMIC SECTION: Samuel M. Janney, Jr.","ECONOMIC SECTION: Samuel M. Janney, Jr.",ECONOMIC SECTION," Samuel M. Janney, Jr.",,Samuel,M.,Janney,Jr.,Samuel,Samuel Janney
AMBASSADOR: Douglas Henderson,AMBASSADOR: Douglas Henderson,AMBASSADOR: Douglas Henderson,AMBASSADOR, Douglas Henderson,,Douglas,,Henderson,,Douglas,Douglas Henderson
DEPUTY CHIEF OF MISSION: Robert A. Hurwitch,DEPUTY CHIEF OF MISSION: Robert A. Hurwitch,DEPUTY CHIEF OF MISSION: Robert A. Hurwitch,DEPUTY CHIEF OF MISSION, Robert A. Hurwitch,,Robert,A.,Hurwitch,,Robert,Robert Hurwitch
ECONOMIC SECTION: William D. Broderick,ECONOMIC SECTION: William D. Broderick,ECONOMIC SECTION: William D. Broderick,ECONOMIC SECTION, William D. Broderick,,William,D.,Broderick,,William,William Broderick
COMMERCIAL SECTION: William G. Gibson,COMMERCIAL SECTION: William G. Gibson,COMMERCIAL SECTION: William G. Gibson,COMMERCIAL SECTION, William G. Gibson,,William,G.,Gibson,,William,William Gibson
AID MISSION DIRECTOR: Alexander Firfer,AID MISSION DIRECTOR: Alexander Firfer,AID MISSION DIRECTOR: Alexander Firfer,AID MISSION DIRECTOR, Alexander Firfer,,Alexander,,Firfer,,Alexander,Alexander Firfer
AMBASSADOR: Lincoln Gordon,AMBASSADOR: Lincoln Gordon,AMBASSADOR: Lincoln Gordon,AMBASSADOR, Lincoln Gordon,,Lincoln,,Gordon,,Lincoln,Lincoln Gordon
DEPUTY CHIEF OF MISSION: John G. Mein,DEPUTY CHIEF OF MISSION: John G. Mein,DEPUTY CHIEF OF MISSION: John G. Mein,DEPUTY CHIEF OF MISSION, John G. Mein,,John,G.,Mein,,John,John Mein
POLITICAL SECTION: John Keppel,POLITICAL SECTION: John Keppel,POLITICAL SECTION: John Keppel,POLITICAL SECTION, John Keppel,,John,,Keppel,,John,John Keppel
ECONOMIC SECTICN: Robert B. Elwood,ECONOMIC SECTICN: Robert B. Elwood,ECONOMIC SECTICN: Robert B. Elwood,ECONOMIC SECTICN, Robert B. Elwood,,Robert,B.,Elwood,,Robert,Robert Elwood
COMMERCIAL SECTION: Edward J. Bash,COMMERCIAL SECTION: Edward J. Bash,COMMERCIAL SECTION: Edward J. Bash,COMMERCIAL SECTION, Edward J. Bash,,Edward,J.,Bash,,Edward,Edward Bash
AGRICULTURAL ATTACHE: Jerome M. Kuhl,AGRICULTURAL ATTACHE: Jerome M. Kuhl,AGRICULTURAL ATTACHE: Jerome M. Kuhl,AGRICULTURAL ATTACHE, Jerome M. Kuhl,,Jerome,M.,Kuhl,,Jerome,Jerome Kuhl
AID MISSION DIRECTOR: Stuart H. Van Dyke,AID MISSION DIRECTOR: Stuart H. Van Dyke,AID MISSION DIRECTOR: Stuart H. Van Dyke,AID MISSION DIRECTOR, Stuart H. Van Dyke,,Stuart,H.,Van Dyke,,Stuart,Stuart Van Dyke
COUNSELOR: Robert W. Dean,COUNSELOR: Robert W. Dean,COUNSELOR: Robert W. Dean,COUNSELOR, Robert W. Dean,,Robert,W.,Dean,,Robert,Robert Dean
ECONOMIC SECTION: Williams Beal,ECONOMIC SECTION: Williams Beal,ECONOMIC SECTION: Williams Beal,ECONOMIC SECTION, Williams Beal,,Williams,,Beal,,Williams,Williams Beal
CONSULATE GENERAL: Recife,CONSULATE GENERAL: Recife,CONSULATE GENERAL: Recife,CONSULATE GENERAL, Recife,,Recife,,,,Recife,Recife 
CONSUL GENERAL: Edward J. Rowell,CONSUL GENERAL: Edward J. Rowell,CONSUL GENERAL: Edward J. Rowell,CONSUL GENERAL, Edward J. Rowell,,Edward,J.,Rowell,,Edward,Edward Rowell
COMMERCIAL SECTION: Fred Exton,COMMERCIAL SECTION: Fred Exton,COMMERCIAL SECTION: Fred Exton,COMMERCIAL SECTION, Fred Exton,,Fred,,Exton,,Fred,Fred Exton
CONSULATE GENERAL: Sao Paulo,CONSULATE GENERAL: Sao Paulo,CONSULATE GENERAL: Sao Paulo,CONSULATE GENERAL, Sao Paulo,,Sao,,Paulo,,Sao,Sao Paulo
CONSUL GENERAL: Niles W. Bond,CONSUL GENERAL: Niles W. Bond,CONSUL GENERAL: Niles W. Bond,CONSUL GENERAL, Niles W. Bond,,Niles,W.,Bond,,Niles,Niles Bond
COMMERCIAL SECTION: Herman J. Jelinek,COMMERCIAL SECTION: Herman J. Jelinek,COMMERCIAL SECTION: Herman J. Jelinek,COMMERCIAL SECTION, Herman J. Jelinek,,Herman,J.,Jelinek,,Herman,Herman Jelinek
CONSULATE GENERAL: Georgetown,CONSULATE GENERAL: Georgetown,CONSULATE GENERAL: Georgetown,CONSULATE GENERAL, Georgetown,,Georgetown,,,,Georgetown,Georgetown 
CONSUL GENERAL: Delmar R. Carlson,CONSUL GENERAL: Delmar R. Carlson,CONSUL GENERAL: Delmar R. Carlson,CONSUL GENERAL, Delmar R. Carlson,,Delmar,R.,Carlson,,Delmar,Delmar Carlson
ECONOMIC SECTION: George W. Ogg,ECONOMIC SECTION: George W. Ogg,ECONOMIC SECTION: George W. Ogg,ECONOMIC SECTION, George W. Ogg,,George,W.,Ogg,,George,George Ogg
AID REPRESENTATIVE: Harry W. Yoe,AID REPRESENTATIVE: Harry W. Yoe,AID REPRESENTATIVE: Harry W. Yoe,AID REPRESENTATIVE, Harry W. Yoe,,Harry,W.,Yoe,,Harry,Harry Yoe
LEGATION: Sofia,LEGATION: Sofia,LEGATION: Sofia,LEGATION, Sofia,,Sofia,,,,Sofia,Sofia 
DEPUTY CHIEF OF MISSION: Richard E. Johnson,DEPUTY CHIEF OF MISSION: Richard E. Johnson,DEPUTY CHIEF OF MISSION: Richard E. Johnson,DEPUTY CHIEF OF MISSION, Richard E. Johnson,,Richard,E.,Johnson,,Richard,Richard Johnson
POLITICAL SECTION: Timothy A. Pfeiffer,POLITICAL SECTION: Timothy A. Pfeiffer,POLITICAL SECTION: Timothy A. Pfeiffer,POLITICAL SECTION, Timothy A. Pfeiffer,,Timothy,A.,Pfeiffer,,Timothy,Timothy Pfeiffer
ECONOMIC SECTION: Donald C. Tice,ECONOMIC SECTION: Donald C. Tice,ECONOMIC SECTION: Donald C. Tice,ECONOMIC SECTION, Donald C. Tice,,Donald,C.,Tice,,Donald,Donald Tice
AMBASSADOR: Henry A. Byroade,AMBASSADOR: Henry A. Byroade,AMBASSADOR: Henry A. Byroade,AMBASSADOR, Henry A. Byroade,,Henry,A.,Byroade,,Henry,Henry Byroade
POLITICAL SECTION: Kingdon W. Swayne,POLITICAL SECTION: Kingdon W. Swayne,POLITICAL SECTION: Kingdon W. Swayne,POLITICAL SECTION, Kingdon W. Swayne,,Kingdon,W.,Swayne,,Kingdon,Kingdon Swayne
ECONOMIC SECTION: Lubert O. Sanderhoff,ECONOMIC SECTION: Lubert O. Sanderhoff,ECONOMIC SECTION: Lubert O. Sanderhoff,ECONOMIC SECTION, Lubert O. Sanderhoff,,Lubert,O.,Sanderhoff,,Lubert,Lubert Sanderhoff
AMBASSADOR: Donald A. Dumont,AMBASSADOR: Donald A. Dumont,AMBASSADOR: Donald A. Dumont,AMBASSADOR, Donald A. Dumont,,Donald,A.,Dumont,,Donald,Donald Dumont
DEPUTY CHIEF OF MISSION: Thompson R. Buchanan,DEPUTY CHIEF OF MISSION: Thompson R. Buchanan,DEPUTY CHIEF OF MISSION: Thompson R. Buchanan,DEPUTY CHIEF OF MISSION, Thompson R. Buchanan,,Thompson,R.,Buchanan,,Thompson,Thompson Buchanan
"POLITICAL SECTION: Martin J. Bergin, Jr.","POLITICAL SECTION: Martin J. Bergin, Jr.","POLITICAL SECTION: Martin J. Bergin, Jr.",POLITICAL SECTION," Martin J. Bergin, Jr.",,Martin,J.,Bergin,Jr.,Martin,Martin Bergin
DEPUTY CHIEF OF MISSION: Charles K. Moffly,DEPUTY CHIEF OF MISSION: Charles K. Moffly,DEPUTY CHIEF OF MISSION: Charles K. Moffly,DEPUTY CHIEF OF MISSION, Charles K. Moffly,,Charles,K.,Moffly,,Charles,Charles Moffly
POLITICAL SECTION: John P. Blane,POLITICAL SECTION: John P. Blane,POLITICAL SECTION: John P. Blane,POLITICAL SECTION, John P. Blane,,John,P.,Blane,,John,John Blane
ECONOMIC SECTION: Lloyd L. Lee,ECONOMIC SECTION: Lloyd L. Lee,ECONOMIC SECTION: Lloyd L. Lee,ECONOMIC SECTION, Lloyd L. Lee,,Lloyd,L.,Lee,,Lloyd,Lloyd Lee
AMBASSADOR: W. Walton Butterworth,AMBASSADOR: W. Walton Butterworth,AMBASSADOR: W. Walton Butterworth,AMBASSADOR, W. Walton Butterworth,,W.,Walton,Butterworth,,Walton,Walton Butterworth
DEPUTY CHIEF OF MISSON: Joseph W. Scott,DEPUTY CHIEF OF MISSON: Joseph W. Scott,DEPUTY CHIEF OF MISSON: Joseph W. Scott,DEPUTY CHIEF OF MISSON, Joseph W. Scott,,Joseph,W.,Scott,,Joseph,Joseph Scott
"POLITICAL SECTION: William M. Johnson, Jr.","POLITICAL SECTION: William M. Johnson, Jr.","POLITICAL SECTION: William M. Johnson, Jr.",POLITICAL SECTION," William M. Johnson, Jr.",,William,M.,Johnson,Jr.,William,William Johnson
ECONOMIC SECTION: Francis A. Linville,ECONOMIC SECTION: Francis A. Linville,ECONOMIC SECTION: Francis A. Linville,ECONOMIC SECTION, Francis A. Linville,,Francis,A.,Linville,,Francis,Francis Linville
COMMERCIAL SECTION: Leonard H. Price,COMMERCIAL SECTION: Leonard H. Price,COMMERCIAL SECTION: Leonard H. Price,COMMERCIAL SECTION, Leonard H. Price,,Leonard,H.,Price,,Leonard,Leonard Price
AGRICULTURAL ATTACHE: John C. McDonald,AGRICULTURAL ATTACHE: John C. McDonald,AGRICULTURAL ATTACHE: John C. McDonald,AGRICULTURAL ATTACHE, John C. McDonald,,John,C.,McDonald,,John,John McDonald
"CONSULATE GENERAL: Calgary, Alberta","CONSULATE GENERAL: Calgary, Alberta","CONSULATE GENERAL: Calgary, Alberta",CONSULATE GENERAL," Calgary, Alberta",,Alberta,,Calgary,,Alberta,Alberta Calgary
CONSUL GENERAL: John L. Hagan,CONSUL GENERAL: John L. Hagan,CONSUL GENERAL: John L. Hagan,CONSUL GENERAL, John L. Hagan,,John,L.,Hagan,,John,John Hagan
"CONSULATE GENERAL: Halifax, Nova Scotia","CONSULATE GENERAL: Halifax, Nova Scotia","CONSULATE GENERAL: Halifax, Nova Scotia",CONSULATE GENERAL," Halifax, Nova Scotia",,Nova,Scotia,Halifax,,Nova,Nova Halifax
CONSUL GENERAL: Robert S. Black,CONSUL GENERAL: Robert S. Black,CONSUL GENERAL: Robert S. Black,CONSUL GENERAL, Robert S. Black,,Robert,S.,Black,,Robert,Robert Black
"CONSULATE GENERAL: Montreal, Quebec","CONSULATE GENERAL: Montreal, Quebec","CONSULATE GENERAL: Montreal, Quebec",CONSULATE GENERAL," Montreal, Quebec",,Quebec,,Montreal,,Quebec,Quebec Montreal
"CONSUL GENERAL: Richard H. Hawkins, Jr.","CONSUL GENERAL: Richard H. Hawkins, Jr.","CONSUL GENERAL: Richard H. Hawkins, Jr.",CONSUL GENERAL," Richard H. Hawkins, Jr.",,Richard,H.,Hawkins,Jr.,Richard,Richard Hawkins
ECONOMIC SECTION: Frederick T. Rope,ECONOMIC SECTION: Frederick T. Rope,ECONOMIC SECTION: Frederick T. Rope,ECONOMIC SECTION, Frederick T. Rope,,Frederick,T.,Rope,,Frederick,Frederick Rope
"CONSULATE GENERAL: Quebec, Quebec","CONSULATE GENERAL: Quebec, Quebec","CONSULATE GENERAL: Quebec, Quebec",CONSULATE GENERAL," Quebec, Quebec",,Quebec,,Quebec,,Quebec,Quebec Quebec
CONSUL GENERAL: Jerome T. Gaspard,CONSUL GENERAL: Jerome T. Gaspard,CONSUL GENERAL: Jerome T. Gaspard,CONSUL GENERAL, Jerome T. Gaspard,,Jerome,T.,Gaspard,,Jerome,Jerome Gaspard
"CONSULATE GENERAL: St. John's, Newfoundland","CONSULATE GENERAL: St. John's, Newfoundland","CONSULATE GENERAL: St. John's, Newfoundland",CONSULATE GENERAL," St. John's, Newfoundland",,Newfoundland,,St. John's,,Newfoundland,Newfoundland St. John's
CONSUL GENERAL: Homer W. Lanford,CONSUL GENERAL: Homer W. Lanford,CONSUL GENERAL: Homer W. Lanford,CONSUL GENERAL, Homer W. Lanford,,Homer,W.,Lanford,,Homer,Homer Lanford
"CONSULATE GENERAL: Toronto, Ontario","CONSULATE GENERAL: Toronto, Ontario","CONSULATE GENERAL: Toronto, Ontario",CONSULATE GENERAL," Toronto, Ontario",,Ontario,,Toronto,,Ontario,Ontario Toronto
"CONSUL GENERAL: W. Park Armstrong, Jr.","CONSUL GENERAL: W. Park Armstrong, Jr.","CONSUL GENERAL: W. Park Armstrong, Jr.",CONSUL GENERAL," W. Park Armstrong, Jr.",,W.,Park,Armstrong,Jr.,Park,Park Armstrong
ECONOMIC SECTION: William E. Price,ECONOMIC SECTION: William E. Price,ECONOMIC SECTION: William E. Price,ECONOMIC SECTION, William E. Price,,William,E.,Price,,William,William Price
"CONSULATE GENERAL: Vancouver, British Columbia","CONSULATE GENERAL: Vancouver, British Columbia","CONSULATE GENERAL: Vancouver, British Columbia",CONSULATE GENERAL," Vancouver, British Columbia",British,Columbia,,Vancouver,,Columbia,Columbia Vancouver
CONSUL GENERAL: Avery F. Peterson,CONSUL GENERAL: Avery F. Peterson,CONSUL GENERAL: Avery F. Peterson,CONSUL GENERAL, Avery F. Peterson,,Avery,F.,Peterson,,Avery,Avery Peterson
ECONOMIC SECTION: Arne T. Fliflet,ECONOMIC SECTION: Arne T. Fliflet,ECONOMIC SECTION: Arne T. Fliflet,ECONOMIC SECTION, Arne T. Fliflet,,Arne,T.,Fliflet,,Arne,Arne Fliflet
"CONSULATE GENERAL: Winnipeg, Manitoba","CONSULATE GENERAL: Winnipeg, Manitoba","CONSULATE GENERAL: Winnipeg, Manitoba",CONSULATE GENERAL," Winnipeg, Manitoba",,Manitoba,,Winnipeg,,Manitoba,Manitoba Winnipeg
CONSUL GENERAL: John H. Morris,CONSUL GENERAL: John H. Morris,CONSUL GENERAL: John H. Morris,CONSUL GENERAL, John H. Morris,,John,H.,Morris,,John,John Morris
AMBASSADOR: Claude G. Ross,AMBASSADOR: Claude G. Ross,AMBASSADOR: Claude G. Ross,AMBASSADOR, Claude G. Ross,,Claude,G.,Ross,,Claude,Claude Ross
DEPUTY CHIEF OF MISSION: Edward T. Brennan,DEPUTY CHIEF OF MISSION: Edward T. Brennan,DEPUTY CHIEF OF MISSION: Edward T. Brennan,DEPUTY CHIEF OF MISSION, Edward T. Brennan,,Edward,T.,Brennan,,Edward,Edward Brennan
AMBASSADOR: Cecil B. Lyon,AMBASSADOR: Cecil B. Lyon,AMBASSADOR: Cecil B. Lyon,AMBASSADOR, Cecil B. Lyon,,Cecil,B.,Lyon,,Cecil,Cecil Lyon
DEPUTY CHIEF OF MISSION: LaRue R. Lutkins,DEPUTY CHIEF OF MISSION: LaRue R. Lutkins,DEPUTY CHIEF OF MISSION: LaRue R. Lutkins,DEPUTY CHIEF OF MISSION, LaRue R. Lutkins,,LaRue,R.,Lutkins,,LaRue,LaRue Lutkins
POLITICAL SECTION: David L. Gamon,POLITICAL SECTION: David L. Gamon,POLITICAL SECTION: David L. Gamon,POLITICAL SECTION, David L. Gamon,,David,L.,Gamon,,David,David Gamon
ECONOMIC SECTION: Michael Calingaert,ECONOMIC SECTION: Michael Calingaert,ECONOMIC SECTION: Michael Calingaert,ECONOMIC SECTION, Michael Calingaert,,Michael,,Calingaert,,Michael,Michael Calingaert
AMBASSADOR: Brewster H. Morris,AMBASSADOR: Brewster H. Morris,AMBASSADOR: Brewster H. Morris,AMBASSADOR, Brewster H. Morris,,Brewster,H.,Morris,,Brewster,Brewster Morris
DEPUTY CHIEF OF MISSION: James F. Relph,DEPUTY CHIEF OF MISSION: James F. Relph,DEPUTY CHIEF OF MISSION: James F. Relph,DEPUTY CHIEF OF MISSION, James F. Relph,,James,F.,Relph,,James,James Relph
AMBASSADOR: Ralph A. Dungan,AMBASSADOR: Ralph A. Dungan,AMBASSADOR: Ralph A. Dungan,AMBASSADOR, Ralph A. Dungan,,Ralph,A.,Dungan,,Ralph,Ralph Dungan
DEPUTY CHIEF OF MISSION: Joseph J. Jova,DEPUTY CHIEF OF MISSION: Joseph J. Jova,DEPUTY CHIEF OF MISSION: Joseph J. Jova,DEPUTY CHIEF OF MISSION, Joseph J. Jova,,Joseph,J.,Jova,,Joseph,Joseph Jova
POLITICAL SECTION: Robert A. Stevenson,POLITICAL SECTION: Robert A. Stevenson,POLITICAL SECTION: Robert A. Stevenson,POLITICAL SECTION, Robert A. Stevenson,,Robert,A.,Stevenson,,Robert,Robert Stevenson
ECONOMIC SECTION: Thomas R. Favell,ECONOMIC SECTION: Thomas R. Favell,ECONOMIC SECTION: Thomas R. Favell,ECONOMIC SECTION, Thomas R. Favell,,Thomas,R.,Favell,,Thomas,Thomas Favell
COMMERCIAL SECTION: Morris Allen,COMMERCIAL SECTION: Morris Allen,COMMERCIAL SECTION: Morris Allen,COMMERCIAL SECTION, Morris Allen,,Morris,,Allen,,Morris,Morris Allen
AID MISSION DIRECTOR: John P. Robinson,AID MISSION DIRECTOR: John P. Robinson,AID MISSION DIRECTOR: John P. Robinson,AID MISSION DIRECTOR, John P. Robinson,,John,P.,Robinson,,John,John Robinson
AMBASSADOR: Covey T. Oliver,AMBASSADOR: Covey T. Oliver,AMBASSADOR: Covey T. Oliver,AMBASSADOR, Covey T. Oliver,,Covey,T.,Oliver,,Covey,Covey Oliver
DEPUTY CHIEF OF MISSION: Henry Dearborn,DEPUTY CHIEF OF MISSION: Henry Dearborn,DEPUTY CHIEF OF MISSION: Henry Dearborn,DEPUTY CHIEF OF MISSION, Henry Dearborn,,Henry,,Dearborn,,Henry,Henry Dearborn
POLITICAL SECTION: Stephen A. Comiskey,POLITICAL SECTION: Stephen A. Comiskey,POLITICAL SECTION: Stephen A. Comiskey,POLITICAL SECTION, Stephen A. Comiskey,,Stephen,A.,Comiskey,,Stephen,Stephen Comiskey
ECONOMIC SECTION: Samuel D. Eaton,ECONOMIC SECTION: Samuel D. Eaton,ECONOMIC SECTION: Samuel D. Eaton,ECONOMIC SECTION, Samuel D. Eaton,,Samuel,D.,Eaton,,Samuel,Samuel Eaton
COMMERCIAL SECTION: George A. Ellsworth,COMMERCIAL SECTION: George A. Ellsworth,COMMERCIAL SECTION: George A. Ellsworth,COMMERCIAL SECTION, George A. Ellsworth,,George,A.,Ellsworth,,George,George Ellsworth
AGRICULTURAL ATTACHE: Robert E. Adcock,AGRICULTURAL ATTACHE: Robert E. Adcock,AGRICULTURAL ATTACHE: Robert E. Adcock,AGRICULTURAL ATTACHE, Robert E. Adcock,,Robert,E.,Adcock,,Robert,Robert Adcock
AID MISSION DIRECTOR: James R. Fowler,AID MISSION DIRECTOR: James R. Fowler,AID MISSION DIRECTOR: James R. Fowler,AID MISSION DIRECTOR, James R. Fowler,,James,R.,Fowler,,James,James Fowler
AMBASSADOR: Henry L. T. Koren,AMBASSADOR: Henry L. T. Koren,AMBASSADOR: Henry L. T. Koren,AMBASSADOR, Henry L. T. Koren,,Henry,L. T.,Koren,,Henry,Henry Koren
DEPUTY CHIEF OF MISSION: Lloyd M. Rives,DEPUTY CHIEF OF MISSION: Lloyd M. Rives,DEPUTY CHIEF OF MISSION: Lloyd M. Rives,DEPUTY CHIEF OF MISSION, Lloyd M. Rives,,Lloyd,M.,Rives,,Lloyd,Lloyd Rives
POLITICAL SECTION: David A. McDonough,POLITICAL SECTION: David A. McDonough,POLITICAL SECTION: David A. McDonough,POLITICAL SECTION, David A. McDonough,,David,A.,McDonough,,David,David McDonough
ECONOMIC SECTION: Charles E. Rushing,ECONOMIC SECTION: Charles E. Rushing,ECONOMIC SECTION: Charles E. Rushing,ECONOMIC SECTION, Charles E. Rushing,,Charles,E.,Rushing,,Charles,Charles Rushing
AMBASSADOR: G. McMurtrie Godley,AMBASSADOR: G. McMurtrie Godley,AMBASSADOR: G. McMurtrie Godley,AMBASSADOR, G. McMurtrie Godley,,G.,McMurtrie,Godley,,McMurtrie,McMurtrie Godley
DEPUTY CHIEF OF MISSION: Robert 0. Blake,DEPUTY CHIEF OF MISSION: Robert 0. Blake,DEPUTY CHIEF OF MISSION: Robert 0. Blake,DEPUTY CHIEF OF MISSION, Robert 0. Blake,,Robert,0.,Blake,,Robert,Robert Blake
POLITICAL SECTION: Monteagle Stearns,POLITICAL SECTION: Monteagle Stearns,POLITICAL SECTION: Monteagle Stearns,POLITICAL SECTION, Monteagle Stearns,,Monteagle,,Stearns,,Monteagle,Monteagle Stearns
ECONOMIC SECTION: Stuart T. Baron,ECONOMIC SECTION: Stuart T. Baron,ECONOMIC SECTION: Stuart T. Baron,ECONOMIC SECTION, Stuart T. Baron,,Stuart,T.,Baron,,Stuart,Stuart Baron
COMMERCIAL SECTION: Martin Jacobs,COMMERCIAL SECTION: Martin Jacobs,COMMERCIAL SECTION: Martin Jacobs,COMMERCIAL SECTION, Martin Jacobs,,Martin,,Jacobs,,Martin,Martin Jacobs
AGRICULTURAL ATTACHE: Paul J. Ferree,AGRICULTURAL ATTACHE: Paul J. Ferree,AGRICULTURAL ATTACHE: Paul J. Ferree,AGRICULTURAL ATTACHE, Paul J. Ferree,,Paul,J.,Ferree,,Paul,Paul Ferree
