text,text_squish,text_joined,rank,name,title,first,middle,last,suffix,first_clean,firstlast
"DEPUTY CHIEF OF MISSION: Albert W. Sheret, Jr.","DEPUTY CHIEF OF MISSION: Albert W. Sheret, Jr.","DEPUTY CHIEF OF MISSION: Albert W. Sheret, Jr.",DEPUTY CHIEF OF MISSION," Albert W. Sheret, Jr.",,Albert,W.,Sheret,Jr.,Albert,Albert Sheret
POLITICAL SECTION: John D. Scanlon,POLITICAL SECTION: John D. Scanlon,POLITICAL SECTION: John D. Scanlon,POLITICAL SECTION, John D. Scanlon,,John,D.,Scanlon,,John,John Scanlon
ECONOMIC SECTION: S. Douglas Martin,ECONOMIC SECTION: S. Douglas Martin,ECONOMIC SECTION: S. Douglas Martin,ECONOMIC SECTION, S. Douglas Martin,,S.,Douglas,Martin,,Douglas,Douglas Martin
AGRICULTURAL ATTACHE: Roger S. Euler,AGRICULTURAL ATTACHE: Roger S. Euler,AGRICULTURAL ATTACHE: Roger S. Euler,AGRICULTURAL ATTACHE, Roger S. Euler,,Roger,S.,Euler,,Roger,Roger Euler
"AMBASSADOR: George W. Anderson, Jr.","AMBASSADOR: George W. Anderson, Jr.","AMBASSADOR: George W. Anderson, Jr.",AMBASSADOR," George W. Anderson, Jr.",,George,W.,Anderson,Jr.,George,George Anderson
DEPUTY CHIEF OF MISSION: William L. Blue,DEPUTY CHIEF OF MISSION: William L. Blue,DEPUTY CHIEF OF MISSION: William L. Blue,DEPUTY CHIEF OF MISSION, William L. Blue,,William,L.,Blue,,William,William Blue
POLITICAL SECTION: Frank J. Devine,POLITICAL SECTION: Frank J. Devine,POLITICAL SECTION: Frank J. Devine,POLITICAL SECTION, Frank J. Devine,,Frank,J.,Devine,,Frank,Frank Devine
ECONOMIC SECTION: John F. Buckle,ECONOMIC SECTION: John F. Buckle,ECONOMIC SECTION: John F. Buckle,ECONOMIC SECTION, John F. Buckle,,John,F.,Buckle,,John,John Buckle
COMMERCIAL SECTION: Robert W. Wagner,COMMERCIAL SECTION: Robert W. Wagner,COMMERCIAL SECTION: Robert W. Wagner,COMMERCIAL SECTION, Robert W. Wagner,,Robert,W.,Wagner,,Robert,Robert Wagner
AGRICULTURAL ATTACHE: Larry F. Thomasson,AGRICULTURAL ATTACHE: Larry F. Thomasson,AGRICULTURAL ATTACHE: Larry F. Thomasson,AGRICULTURAL ATTACHE, Larry F. Thomasson,,Larry,F.,Thomasson,,Larry,Larry Thomasson
AMBASSADOR: William A. Crawford,AMBASSADOR: William A. Crawford,AMBASSADOR: William A. Crawford,AMBASSADOR, William A. Crawford,,William,A.,Crawford,,William,William Crawford
DEPUTY CHIEF OF MISSION: John P. Shaw,DEPUTY CHIEF OF MISSION: John P. Shaw,DEPUTY CHIEF OF MISSION: John P. Shaw,DEPUTY CHIEF OF MISSION, John P. Shaw,,John,P.,Shaw,,John,John Shaw
POLITICAL SECTION: William A. Bell,POLITICAL SECTION: William A. Bell,POLITICAL SECTION: William A. Bell,POLITICAL SECTION, William A. Bell,,William,A.,Bell,,William,William Bell
ECONOMIC SECTION: Jack M. Carle,ECONOMIC SECTION: Jack M. Carle,ECONOMIC SECTION: Jack M. Carle,ECONOMIC SECTION, Jack M. Carle,,Jack,M.,Carle,,Jack,Jack Carle
AMBASSADOR: Charles D. Withers,AMBASSADOR: Charles D. Withers,AMBASSADOR: Charles D. Withers,AMBASSADOR, Charles D. Withers,,Charles,D.,Withers,,Charles,Charles Withers
DEPUTY CHIEF OF MISSION: William N. Harben,DEPUTY CHIEF OF MISSION: William N. Harben,DEPUTY CHIEF OF MISSION: William N. Harben,DEPUTY CHIEF OF MISSION, William N. Harben,,William,N.,Harben,,William,William Harben
AMBASSADOR: Parker T. Hart,AMBASSADOR: Parker T. Hart,AMBASSADOR: Parker T. Hart,AMBASSADOR, Parker T. Hart,,Parker,T.,Hart,,Parker,Parker Hart
DEPUTY CHIEF OF MISSION: Nicholas G. Thacher,DEPUTY CHIEF OF MISSION: Nicholas G. Thacher,DEPUTY CHIEF OF MISSION: Nicholas G. Thacher,DEPUTY CHIEF OF MISSION, Nicholas G. Thacher,,Nicholas,G.,Thacher,,Nicholas,Nicholas Thacher
POLITICAL SECTION: Richard W. Murphy,POLITICAL SECTION: Richard W. Murphy,POLITICAL SECTION: Richard W. Murphy,POLITICAL SECTION, Richard W. Murphy,,Richard,W.,Murphy,,Richard,Richard Murphy
"ECONOMIC SECTION: Slator C. Blackiston, Jr.","ECONOMIC SECTION: Slator C. Blackiston, Jr.","ECONOMIC SECTION: Slator C. Blackiston, Jr.",ECONOMIC SECTION," Slator C. Blackiston, Jr.",,Slator,C.,Blackiston,Jr.,Slator,Slator Blackiston
CONSULATE GENERAL: Dhahran,CONSULATE GENERAL: Dhahran,CONSULATE GENERAL: Dhahran,CONSULATE GENERAL, Dhahran,,Dhahran,,,,Dhahran,Dhahran 
CONSUL GENERAL: Arthur B. Allen,CONSUL GENERAL: Arthur B. Allen,CONSUL GENERAL: Arthur B. Allen,CONSUL GENERAL, Arthur B. Allen,,Arthur,B.,Allen,,Arthur,Arthur Allen
ECONOMIC SECTION: Eugene H. Bird,ECONOMIC SECTION: Eugene H. Bird,ECONOMIC SECTION: Eugene H. Bird,ECONOMIC SECTION, Eugene H. Bird,,Eugene,H.,Bird,,Eugene,Eugene Bird
"COMMERCIAL SECTION: Thomas J. Carolan, Jr.","COMMERCIAL SECTION: Thomas J. Carolan, Jr.","COMMERCIAL SECTION: Thomas J. Carolan, Jr.",COMMERCIAL SECTION," Thomas J. Carolan, Jr.",,Thomas,J.,Carolan,Jr.,Thomas,Thomas Carolan
AMBASSADOR: Mercer Cook,AMBASSADOR: Mercer Cook,AMBASSADOR: Mercer Cook,AMBASSADOR, Mercer Cook,,Mercer,,Cook,,Mercer,Mercer Cook
DEPUTY CHIEF OF MISSION: John A. McKesson,DEPUTY CHIEF OF MISSION: John A. McKesson,DEPUTY CHIEF OF MISSION: John A. McKesson,DEPUTY CHIEF OF MISSION, John A. McKesson,,John,A.,McKesson,,John,John McKesson
POLITICAL SECTION: Donald B. Easum,POLITICAL SECTION: Donald B. Easum,POLITICAL SECTION: Donald B. Easum,POLITICAL SECTION, Donald B. Easum,,Donald,B.,Easum,,Donald,Donald Easum
ECONOMIC SECTION: Charles C. Adams,ECONOMIC SECTION: Charles C. Adams,ECONOMIC SECTION: Charles C. Adams,ECONOMIC SECTION, Charles C. Adams,,Charles,C.,Adams,,Charles,Charles Adams
AMBASSADOR: Andrew V. Corry,AMBASSADOR: Andrew V. Corry,AMBASSADOR: Andrew V. Corry,AMBASSADOR, Andrew V. Corry,,Andrew,V.,Corry,,Andrew,Andrew Corry
DEPUTY CHIEF OF MISSION: Donald S. Spigle,DEPUTY CHIEF OF MISSION: Donald S. Spigle,DEPUTY CHIEF OF MISSION: Donald S. Spigle,DEPUTY CHIEF OF MISSION, Donald S. Spigle,,Donald,S.,Spigle,,Donald,Donald Spigle
POLITICAL SECTION: Robert H. Lupton,POLITICAL SECTION: Robert H. Lupton,POLITICAL SECTION: Robert H. Lupton,POLITICAL SECTION, Robert H. Lupton,,Robert,H.,Lupton,,Robert,Robert Lupton
ECONOMIC SECTION: Guido C. Fenzi,ECONOMIC SECTION: Guido C. Fenzi,ECONOMIC SECTION: Guido C. Fenzi,ECONOMIC SECTION, Guido C. Fenzi,,Guido,C.,Fenzi,,Guido,Guido Fenzi
"AMBASSADOR: Horace G. Torbert, Jr.","AMBASSADOR: Horace G. Torbert, Jr.","AMBASSADOR: Horace G. Torbert, Jr.",AMBASSADOR," Horace G. Torbert, Jr.",,Horace,G.,Torbert,Jr.,Horace,Horace Torbert
DEPUTY CHIEF OF MISSION: Alexander C. Johnpoll,DEPUTY CHIEF OF MISSION: Alexander C. Johnpoll,DEPUTY CHIEF OF MISSION: Alexander C. Johnpoll,DEPUTY CHIEF OF MISSION, Alexander C. Johnpoll,,Alexander,C.,Johnpoll,,Alexander,Alexander Johnpoll
POLITICAL SECTION: Francis N. Magliozzi,POLITICAL SECTION: Francis N. Magliozzi,POLITICAL SECTION: Francis N. Magliozzi,POLITICAL SECTION, Francis N. Magliozzi,,Francis,N.,Magliozzi,,Francis,Francis Magliozzi
ECONOMIC SECTION: William T. Sandalls,ECONOMIC SECTION: William T. Sandalls,ECONOMIC SECTION: William T. Sandalls,ECONOMIC SECTION, William T. Sandalls,,William,T.,Sandalls,,William,William Sandalls
AID MISSION DIRECTOR: John W. Robinson (Acting),AID MISSION DIRECTOR: John W. Robinson (Acting),AID MISSION DIRECTOR: John W. Robinson (Acting),AID MISSION DIRECTOR, John W. Robinson (Acting),,John,W.,Robinson,,John,John Robinson
AMBASSADOR: Joseph C. Satterthwaite,AMBASSADOR: Joseph C. Satterthwaite,AMBASSADOR: Joseph C. Satterthwaite,AMBASSADOR, Joseph C. Satterthwaite,,Joseph,C.,Satterthwaite,,Joseph,Joseph Satterthwaite
DEPUTY CHIEF OF MISSION: G. Edward Clark,DEPUTY CHIEF OF MISSION: G. Edward Clark,DEPUTY CHIEF OF MISSION: G. Edward Clark,DEPUTY CHIEF OF MISSION, G. Edward Clark,,G.,Edward,Clark,,Edward,Edward Clark
POLITICAL SECTION: William H. Witt,POLITICAL SECTION: William H. Witt,POLITICAL SECTION: William H. Witt,POLITICAL SECTION, William H. Witt,,William,H.,Witt,,William,William Witt
ECONOMIC SECTION: John Miles,ECONOMIC SECTION: John Miles,ECONOMIC SECTION: John Miles,ECONOMIC SECTION, John Miles,,John,,Miles,,John,John Miles
AGRICULTURAL ATTACHE: William J. Edens,AGRICULTURAL ATTACHE: William J. Edens,AGRICULTURAL ATTACHE: William J. Edens,AGRICULTURAL ATTACHE, William J. Edens,,William,J.,Edens,,William,William Edens
CONSULATE GENERAL: Cape Town,CONSULATE GENERAL: Cape Town,CONSULATE GENERAL: Cape Town,CONSULATE GENERAL, Cape Town,,Cape,,Town,,Cape,Cape Town
CONSUL GENERAL: Livingston D. Watrous,CONSUL GENERAL: Livingston D. Watrous,CONSUL GENERAL: Livingston D. Watrous,CONSUL GENERAL, Livingston D. Watrous,,Livingston,D.,Watrous,,Livingston,Livingston Watrous
ECONOMIC SECTION: James C. Curran,ECONOMIC SECTION: James C. Curran,ECONOMIC SECTION: James C. Curran,ECONOMIC SECTION, James C. Curran,,James,C.,Curran,,James,James Curran
CONSULATE GENERAL: Durban,CONSULATE GENERAL: Durban,CONSULATE GENERAL: Durban,CONSULATE GENERAL, Durban,,Durban,,,,Durban,Durban 
CONSUL GENERAL: William D. Toomey,CONSUL GENERAL: William D. Toomey,CONSUL GENERAL: William D. Toomey,CONSUL GENERAL, William D. Toomey,,William,D.,Toomey,,William,William Toomey
CONSULATE GENERAL: Johannesburg,CONSULATE GENERAL: Johannesburg,CONSULATE GENERAL: Johannesburg,CONSULATE GENERAL, Johannesburg,,Johannesburg,,,,Johannesburg,Johannesburg 
CONSUL GENERAL: Herbert Reiner,CONSUL GENERAL: Herbert Reiner,CONSUL GENERAL: Herbert Reiner,CONSUL GENERAL, Herbert Reiner,,Herbert,,Reiner,,Herbert,Herbert Reiner
COMMERCIAL SECTION: Joseph L. Dougherty,COMMERCIAL SECTION: Joseph L. Dougherty,COMMERCIAL SECTION: Joseph L. Dougherty,COMMERCIAL SECTION, Joseph L. Dougherty,,Joseph,L.,Dougherty,,Joseph,Joseph Dougherty
CONSULATE GENERAL: Salisbury,CONSULATE GENERAL: Salisbury,CONSULATE GENERAL: Salisbury,CONSULATE GENERAL, Salisbury,,Salisbury,,,,Salisbury,Salisbury 
CONSUL GENERAL: Roswell D. McClelland,CONSUL GENERAL: Roswell D. McClelland,CONSUL GENERAL: Roswell D. McClelland,CONSUL GENERAL, Roswell D. McClelland,,Roswell,D.,McClelland,,Roswell,Roswell McClelland
DEPUTY PRINCIPAL OFFICER: Stephen G. Gebelt,DEPUTY PRINCIPAL OFFICER: Stephen G. Gebelt,DEPUTY PRINCIPAL OFFICER: Stephen G. Gebelt,DEPUTY PRINCIPAL OFFICER, Stephen G. Gebelt,,Stephen,G.,Gebelt,,Stephen,Stephen Gebelt
ECONOMIC SECTION: John P. Wentworth,ECONOMIC SECTION: John P. Wentworth,ECONOMIC SECTION: John P. Wentworth,ECONOMIC SECTION, John P. Wentworth,,John,P.,Wentworth,,John,John Wentworth
AMBASSADOR: Robert F. Woodward,AMBASSADOR: Robert F. Woodward,AMBASSADOR: Robert F. Woodward,AMBASSADOR, Robert F. Woodward,,Robert,F.,Woodward,,Robert,Robert Woodward
DEPUTY CHIEF OF MISSION: William A. Walker,DEPUTY CHIEF OF MISSION: William A. Walker,DEPUTY CHIEF OF MISSION: William A. Walker,DEPUTY CHIEF OF MISSION, William A. Walker,,William,A.,Walker,,William,William Walker
POLITICAL SECTION: Robert W.Zimmerman,POLITICAL SECTION: Robert W.Zimmerman,POLITICAL SECTION: Robert W.Zimmerman,POLITICAL SECTION, Robert W.Zimmerman,,Robert,,W.Zimmerman,,Robert,Robert W.Zimmerman
ECONOMIC SECTION: John I. Fishbume,ECONOMIC SECTION: John I. Fishbume,ECONOMIC SECTION: John I. Fishbume,ECONOMIC SECTION, John I. Fishbume,,John,I.,Fishbume,,John,John Fishbume
"COMMERCIAL SECTION: Henry L. Pitts, Jr.","COMMERCIAL SECTION: Henry L. Pitts, Jr.","COMMERCIAL SECTION: Henry L. Pitts, Jr.",COMMERCIAL SECTION," Henry L. Pitts, Jr.",,Henry,L.,Pitts,Jr.,Henry,Henry Pitts
AGRICULTURAL ATTACHE: Douglas M. Crawford,AGRICULTURAL ATTACHE: Douglas M. Crawford,AGRICULTURAL ATTACHE: Douglas M. Crawford,AGRICULTURAL ATTACHE, Douglas M. Crawford,,Douglas,M.,Crawford,,Douglas,Douglas Crawford
CONSULATE GENERAL: Barcelona,CONSULATE GENERAL: Barcelona,CONSULATE GENERAL: Barcelona,CONSULATE GENERAL, Barcelona,,Barcelona,,,,Barcelona,Barcelona 
CONSUL GENERAL: John Ford,CONSUL GENERAL: John Ford,CONSUL GENERAL: John Ford,CONSUL GENERAL, John Ford,,John,,Ford,,John,John Ford
"ECONOMIC SECTION: Frederick H. Sacksteder, Jr.","ECONOMIC SECTION: Frederick H. Sacksteder, Jr.","ECONOMIC SECTION: Frederick H. Sacksteder, Jr.",ECONOMIC SECTION," Frederick H. Sacksteder, Jr.",,Frederick,H.,Sacksteder,Jr.,Frederick,Frederick Sacksteder
COMMERCIAL SECTION: Allen H. Lester,COMMERCIAL SECTION: Allen H. Lester,COMMERCIAL SECTION: Allen H. Lester,COMMERCIAL SECTION, Allen H. Lester,,Allen,H.,Lester,,Allen,Allen Lester
CONSULATE GENERAL: Seville,CONSULATE GENERAL: Seville,CONSULATE GENERAL: Seville,CONSULATE GENERAL, Seville,,Seville,,,,Seville,Seville 
CONSUL GENERAL: Charles P. Nolan,CONSUL GENERAL: Charles P. Nolan,CONSUL GENERAL: Charles P. Nolan,CONSUL GENERAL, Charles P. Nolan,,Charles,P.,Nolan,,Charles,Charles Nolan
AMBASSADOR: William M. Rountree,AMBASSADOR: William M. Rountree,AMBASSADOR: William M. Rountree,AMBASSADOR, William M. Rountree,,William,M.,Rountree,,William,William Rountree
DEPUTY CHIEF OF MISSION: Thomas M. Recknagel,DEPUTY CHIEF OF MISSION: Thomas M. Recknagel,DEPUTY CHIEF OF MISSION: Thomas M. Recknagel,DEPUTY CHIEF OF MISSION, Thomas M. Recknagel,,Thomas,M.,Recknagel,,Thomas,Thomas Recknagel
POLITICAL SECTION: James D. Moffett,POLITICAL SECTION: James D. Moffett,POLITICAL SECTION: James D. Moffett,POLITICAL SECTION, James D. Moffett,,James,D.,Moffett,,James,James Moffett
ECONOMIC SECTION: James H. Ashida,ECONOMIC SECTION: James H. Ashida,ECONOMIC SECTION: James H. Ashida,ECONOMIC SECTION, James H. Ashida,,James,H.,Ashida,,James,James Ashida
"AGRICULTURAL ATTACHE: James A. Hutchins, Jr.","AGRICULTURAL ATTACHE: James A. Hutchins, Jr.","AGRICULTURAL ATTACHE: James A. Hutchins, Jr.",AGRICULTURAL ATTACHE," James A. Hutchins, Jr.",,James,A.,Hutchins,Jr.,James,James Hutchins
AID MISSION DIRECTOR: William 0. Cooper,AID MISSION DIRECTOR: William 0. Cooper,AID MISSION DIRECTOR: William 0. Cooper,AID MISSION DIRECTOR, William 0. Cooper,,William,0.,Cooper,,William,William Cooper
CONSULATE GENERAL: Pamrmaribo,CONSULATE GENERAL: Pamrmaribo,CONSULATE GENERAL: Pamrmaribo,CONSULATE GENERAL, Pamrmaribo,,Pamrmaribo,,,,Pamrmaribo,Pamrmaribo 
CONSUL GENERAL: W. Garland Richardson,CONSUL GENERAL: W. Garland Richardson,CONSUL GENERAL: W. Garland Richardson,CONSUL GENERAL, W. Garland Richardson,,W.,Garland,Richardson,,Garland,Garland Richardson
ECONOMIC SECTION: James H. Cheatham,ECONOMIC SECTION: James H. Cheatham,ECONOMIC SECTION: James H. Cheatham,ECONOMIC SECTION, James H. Cheatham,,James,H.,Cheatham,,James,James Cheatham
AMBASSADOR: J. Graham Parsons,AMBASSADOR: J. Graham Parsons,AMBASSADOR: J. Graham Parsons,AMBASSADOR, J. Graham Parsons,,J.,Graham,Parsons,,Graham,Graham Parsons
DEPUTY CHIEF OF MISSION: Alfred leS. Jenkins,DEPUTY CHIEF OF MISSION: Alfred leS. Jenkins,DEPUTY CHIEF OF MISSION: Alfred leS. Jenkins,DEPUTY CHIEF OF MISSION, Alfred leS. Jenkins,,Alfred,leS.,Jenkins,,Alfred,Alfred Jenkins
"POLITICAL SECTION: Jerome K. Holloway, Jr.","POLITICAL SECTION: Jerome K. Holloway, Jr.","POLITICAL SECTION: Jerome K. Holloway, Jr.",POLITICAL SECTION," Jerome K. Holloway, Jr.",,Jerome,K.,Holloway,Jr.,Jerome,Jerome Holloway
ECONOMIC SECTION: John A. Birch,ECONOMIC SECTION: John A. Birch,ECONOMIC SECTION: John A. Birch,ECONOMIC SECTION, John A. Birch,,John,A.,Birch,,John,John Birch
COMMERCIAL SECTION: Gustav E. Larson,COMMERCIAL SECTION: Gustav E. Larson,COMMERCIAL SECTION: Gustav E. Larson,COMMERCIAL SECTION, Gustav E. Larson,,Gustav,E.,Larson,,Gustav,Gustav Larson
AGRICULTURAL ATTACHE: Hugh V. Robinson,AGRICULTURAL ATTACHE: Hugh V. Robinson,AGRICULTURAL ATTACHE: Hugh V. Robinson,AGRICULTURAL ATTACHE, Hugh V. Robinson,,Hugh,V.,Robinson,,Hugh,Hugh Robinson
CONSULATE GENERAL: Goteborg,CONSULATE GENERAL: Goteborg,CONSULATE GENERAL: Goteborg,CONSULATE GENERAL, Goteborg,,Goteborg,,,,Goteborg,Goteborg 
CONSUL GENERAL: Sverre M. Backe,CONSUL GENERAL: Sverre M. Backe,CONSUL GENERAL: Sverre M. Backe,CONSUL GENERAL, Sverre M. Backe,,Sverre,M.,Backe,,Sverre,Sverre Backe
"AMBASSADOR: William True Davis, Jr.","AMBASSADOR: William True Davis, Jr.","AMBASSADOR: William True Davis, Jr.",AMBASSADOR," William True Davis, Jr.",,William,True,Davis,Jr.,William,William Davis
DEPUTY CHIEF OF MISSION: Henry J. Kellermann,DEPUTY CHIEF OF MISSION: Henry J. Kellermann,DEPUTY CHIEF OF MISSION: Henry J. Kellermann,DEPUTY CHIEF OF MISSION, Henry J. Kellermann,,Henry,J.,Kellermann,,Henry,Henry Kellermann
POLITICAL SECTION: Henry B. Cox,POLITICAL SECTION: Henry B. Cox,POLITICAL SECTION: Henry B. Cox,POLITICAL SECTION, Henry B. Cox,,Henry,B.,Cox,,Henry,Henry Cox
ECONOMIC SECTION: Jack M. Smith,ECONOMIC SECTION: Jack M. Smith,ECONOMIC SECTION: Jack M. Smith,ECONOMIC SECTION, Jack M. Smith,,Jack,M.,Smith,,Jack,Jack Smith
COMMERCIAL SECTION: Malcolm N. Lawrence,COMMERCIAL SECTION: Malcolm N. Lawrence,COMMERCIAL SECTION: Malcolm N. Lawrence,COMMERCIAL SECTION, Malcolm N. Lawrence,,Malcolm,N.,Lawrence,,Malcolm,Malcolm Lawrence
AGRICULTURAL ATTACHE: Print Hudson,AGRICULTURAL ATTACHE: Print Hudson,AGRICULTURAL ATTACHE: Print Hudson,AGRICULTURAL ATTACHE, Print Hudson,,Print,,Hudson,,Print,Print Hudson
CONSULATE GENERAL: Zurich,CONSULATE GENERAL: Zurich,CONSULATE GENERAL: Zurich,CONSULATE GENERAL, Zurich,,Zurich,,,,Zurich,Zurich 
"CONSUL GENERAL: Howard Elting, Jr.","CONSUL GENERAL: Howard Elting, Jr.","CONSUL GENERAL: Howard Elting, Jr.",CONSUL GENERAL," Howard Elting, Jr.",,Howard,,Elting,Jr.,Howard,Howard Elting
ECONOMIC SECTION: Raymond W. T. Pracht,ECONOMIC SECTION: Raymond W. T. Pracht,ECONOMIC SECTION: Raymond W. T. Pracht,ECONOMIC SECTION, Raymond W. T. Pracht,,Raymond,W. T.,Pracht,,Raymond,Raymond Pracht
COMMERCIAL SECTION: Rene Andrew Lutz,COMMERCIAL SECTION: Rene Andrew Lutz,COMMERCIAL SECTION: Rene Andrew Lutz,COMMERCIAL SECTION, Rene Andrew Lutz,,Rene,Andrew,Lutz,,Rene,Rene Lutz
AMBASSADOR: Ridgway B. Knight,AMBASSADOR: Ridgway B. Knight,AMBASSADOR: Ridgway B. Knight,AMBASSADOR, Ridgway B. Knight,,Ridgway,B.,Knight,,Ridgway,Ridgway Knight
DEPUTY CHIEF OF MISSION: C. Robert Moore,DEPUTY CHIEF OF MISSION: C. Robert Moore,DEPUTY CHIEF OF MISSION: C. Robert Moore,DEPUTY CHIEF OF MISSION, C. Robert Moore,,C.,Robert,Moore,,Robert,Robert Moore
POLITICAL SECTION: Robert A. Stein,POLITICAL SECTION: Robert A. Stein,POLITICAL SECTION: Robert A. Stein,POLITICAL SECTION, Robert A. Stein,,Robert,A.,Stein,,Robert,Robert Stein
ECONOMIC SECTION: John H. Tobler,ECONOMIC SECTION: John H. Tobler,ECONOMIC SECTION: John H. Tobler,ECONOMIC SECTION, John H. Tobler,,John,H.,Tobler,,John,John Tobler
COMMERCIAL SECTION: Leonardo Neher,COMMERCIAL SECTION: Leonardo Neher,COMMERCIAL SECTION: Leonardo Neher,COMMERCIAL SECTION, Leonardo Neher,,Leonardo,,Neher,,Leonardo,Leonardo Neher
CONSULATE GENERAL: Aleppo,CONSULATE GENERAL: Aleppo,CONSULATE GENERAL: Aleppo,CONSULATE GENERAL, Aleppo,,Aleppo,,,,Aleppo,Aleppo 
CONSUL GENERAL: John R. Barrow,CONSUL GENERAL: John R. Barrow,CONSUL GENERAL: John R. Barrow,CONSUL GENERAL, John R. Barrow,,John,R.,Barrow,,John,John Barrow
ECONOMIC SECTION: George M. Lane,ECONOMIC SECTION: George M. Lane,ECONOMIC SECTION: George M. Lane,ECONOMIC SECTION, George M. Lane,,George,M.,Lane,,George,George Lane
AMBASSADOR: Jerauld Wright,AMBASSADOR: Jerauld Wright,AMBASSADOR: Jerauld Wright,AMBASSADOR, Jerauld Wright,,Jerauld,,Wright,,Jerauld,Jerauld Wright
DEPUTY CHIEF OF MISSION: Ralph N. Clough,DEPUTY CHIEF OF MISSION: Ralph N. Clough,DEPUTY CHIEF OF MISSION: Ralph N. Clough,DEPUTY CHIEF OF MISSION, Ralph N. Clough,,Ralph,N.,Clough,,Ralph,Ralph Clough
POLITICAL SECTION: Robert S. Lindquist,POLITICAL SECTION: Robert S. Lindquist,POLITICAL SECTION: Robert S. Lindquist,POLITICAL SECTION, Robert S. Lindquist,,Robert,S.,Lindquist,,Robert,Robert Lindquist
ECONOMIC SECTION: Walter T. Smith,ECONOMIC SECTION: Walter T. Smith,ECONOMIC SECTION: Walter T. Smith,ECONOMIC SECTION, Walter T. Smith,,Walter,T.,Smith,,Walter,Walter Smith
COMMERCIAL SECTION: Oliver B. Bongard,COMMERCIAL SECTION: Oliver B. Bongard,COMMERCIAL SECTION: Oliver B. Bongard,COMMERCIAL SECTION, Oliver B. Bongard,,Oliver,B.,Bongard,,Oliver,Oliver Bongard
AMBASSADOR: William Leonhart,AMBASSADOR: William Leonhart,AMBASSADOR: William Leonhart,AMBASSADOR, William Leonhart,,William,,Leonhart,,William,William Leonhart
DEPUTY CHIEF OF MISSION: Robert C.F. Gordon,DEPUTY CHIEF OF MISSION: Robert C.F. Gordon,DEPUTY CHIEF OF MISSION: Robert C.F. Gordon,DEPUTY CHIEF OF MISSION, Robert C.F. Gordon,,Robert,C.F.,Gordon,,Robert,Robert Gordon
"POLITICAL SECTION: Chris C. Pappas, Jr.","POLITICAL SECTION: Chris C. Pappas, Jr.","POLITICAL SECTION: Chris C. Pappas, Jr.",POLITICAL SECTION," Chris C. Pappas, Jr.",,Chris,C.,Pappas,Jr.,Chris,Chris Pappas
ECONOMIC SECTION: Francis T. McNamara,ECONOMIC SECTION: Francis T. McNamara,ECONOMIC SECTION: Francis T. McNamara,ECONOMIC SECTION, Francis T. McNamara,,Francis,T.,McNamara,,Francis,Francis McNamara
AID MISSION DIRECTOR: E. Allen Loren,AID MISSION DIRECTOR: E. Allen Loren,AID MISSION DIRECTOR: E. Allen Loren,AID MISSION DIRECTOR, E. Allen Loren,,E.,Allen,Loren,,Allen,Allen Loren
CONSULATE GENERAL: Zanzibar,CONSULATE GENERAL: Zanzibar,CONSULATE GENERAL: Zanzibar,CONSULATE GENERAL, Zanzibar,,Zanzibar,,,,Zanzibar,Zanzibar 
CONSUL GENERAL: Frank C. Carlucci,CONSUL GENERAL: Frank C. Carlucci,CONSUL GENERAL: Frank C. Carlucci,CONSUL GENERAL, Frank C. Carlucci,,Frank,C.,Carlucci,,Frank,Frank Carlucci
ECONOMIC SECTION: Kent B. Crane,ECONOMIC SECTION: Kent B. Crane,ECONOMIC SECTION: Kent B. Crane,ECONOMIC SECTION, Kent B. Crane,,Kent,B.,Crane,,Kent,Kent Crane
AMBASSADOR: Graham A. Martin,AMBASSADOR: Graham A. Martin,AMBASSADOR: Graham A. Martin,AMBASSADOR, Graham A. Martin,,Graham,A.,Martin,,Graham,Graham Martin
"DEPUTY CHIEF OF MISSION: James M. Wilson, Jr.","DEPUTY CHIEF OF MISSION: James M. Wilson, Jr.","DEPUTY CHIEF OF MISSION: James M. Wilson, Jr.",DEPUTY CHIEF OF MISSION," James M. Wilson, Jr.",,James,M.,Wilson,Jr.,James,James Wilson
POLITICAL SECTION: Theodore A. Tremblay,POLITICAL SECTION: Theodore A. Tremblay,POLITICAL SECTION: Theodore A. Tremblay,POLITICAL SECTION, Theodore A. Tremblay,,Theodore,A.,Tremblay,,Theodore,Theodore Tremblay
ECONOMIC SECTION: J. Robert Fluker,ECONOMIC SECTION: J. Robert Fluker,ECONOMIC SECTION: J. Robert Fluker,ECONOMIC SECTION, J. Robert Fluker,,J.,Robert,Fluker,,Robert,Robert Fluker
COMMERICAL SECTION: Harold C. Voorhees,COMMERICAL SECTION: Harold C. Voorhees,COMMERICAL SECTION: Harold C. Voorhees,COMMERICAL SECTION, Harold C. Voorhees,,Harold,C.,Voorhees,,Harold,Harold Voorhees
AGRICULTURAL ATTACHE: Samuel H. Work,AGRICULTURAL ATTACHE: Samuel H. Work,AGRICULTURAL ATTACHE: Samuel H. Work,AGRICULTURAL ATTACHE, Samuel H. Work,,Samuel,H.,Work,,Samuel,Samuel Work
AID MISSION DIRECTOR: Tracy S. Park,AID MISSION DIRECTOR: Tracy S. Park,AID MISSION DIRECTOR: Tracy S. Park,AID MISSION DIRECTOR, Tracy S. Park,,Tracy,S.,Park,,Tracy,Tracy Park
AMBASSADOR: William Witman II,AMBASSADOR: William Witman II,AMBASSADOR: William Witman II,AMBASSADOR, William Witman II,,William,,Witman,II,William,William Witman
DEPUTY CHIEF OF MISSION: William B. Hussey,DEPUTY CHIEF OF MISSION: William B. Hussey,DEPUTY CHIEF OF MISSION: William B. Hussey,DEPUTY CHIEF OF MISSION, William B. Hussey,,William,B.,Hussey,,William,William Hussey
ECONOMIC SECTION: Charles H. Hallock,ECONOMIC SECTION: Charles H. Hallock,ECONOMIC SECTION: Charles H. Hallock,ECONOMIC SECTION, Charles H. Hallock,,Charles,H.,Hallock,,Charles,Charles Hallock
AMBASSADOR: Robert G. Miner,AMBASSADOR: Robert G. Miner,AMBASSADOR: Robert G. Miner,AMBASSADOR, Robert G. Miner,,Robert,G.,Miner,,Robert,Robert Miner
DEPUTY CHIEF OF MISSION: Park F. Wollam,DEPUTY CHIEF OF MISSION: Park F. Wollam,DEPUTY CHIEF OF MISSION: Park F. Wollam,DEPUTY CHIEF OF MISSION, Park F. Wollam,,Park,F.,Wollam,,Park,Park Wollam
POLITICAL SECTION: Adolf J. Lium,POLITICAL SECTION: Adolf J. Lium,POLITICAL SECTION: Adolf J. Lium,POLITICAL SECTION, Adolf J. Lium,,Adolf,J.,Lium,,Adolf,Adolf Lium
ECONOMIC SECTION: Robert Gwynn,ECONOMIC SECTION: Robert Gwynn,ECONOMIC SECTION: Robert Gwynn,ECONOMIC SECTION, Robert Gwynn,,Robert,,Gwynn,,Robert,Robert Gwynn
COMMERCIAL SECTION: Robert Gwynn,COMMERCIAL SECTION: Robert Gwynn,COMMERCIAL SECTION: Robert Gwynn,COMMERCIAL SECTION, Robert Gwynn,,Robert,,Gwynn,,Robert,Robert Gwynn
AGRICULTURAL ATTACHE: William B. Callan,AGRICULTURAL ATTACHE: William B. Callan,AGRICULTURAL ATTACHE: William B. Callan,AGRICULTURAL ATTACHE, William B. Callan,,William,B.,Callan,,William,William Callan
AMBASSADOR: Francis H. Russell,AMBASSADOR: Francis H. Russell,AMBASSADOR: Francis H. Russell,AMBASSADOR, Francis H. Russell,,Francis,H.,Russell,,Francis,Francis Russell
DEPUTY CHIEF OF MISSION: Leo G. Cyr,DEPUTY CHIEF OF MISSION: Leo G. Cyr,DEPUTY CHIEF OF MISSION: Leo G. Cyr,DEPUTY CHIEF OF MISSION, Leo G. Cyr,,Leo,G.,Cyr,,Leo,Leo Cyr
POLITICAL SECTION: Stephen H. McClintic,POLITICAL SECTION: Stephen H. McClintic,POLITICAL SECTION: Stephen H. McClintic,POLITICAL SECTION, Stephen H. McClintic,,Stephen,H.,McClintic,,Stephen,Stephen McClintic
ECONOMIC SECTION: Francois M. Dickman,ECONOMIC SECTION: Francois M. Dickman,ECONOMIC SECTION: Francois M. Dickman,ECONOMIC SECTION, Francois M. Dickman,,Francois,M.,Dickman,,Francois,Francois Dickman
AID MISSION DIRECTOR: Daly C Lavergne,AID MISSION DIRECTOR: Daly C Lavergne,AID MISSION DIRECTOR: Daly C Lavergne,AID MISSION DIRECTOR, Daly C Lavergne,,Daly,C,Lavergne,,Daly,Daly Lavergne
AMBASSADOR: Raymond A. Hare,AMBASSADOR: Raymond A. Hare,AMBASSADOR: Raymond A. Hare,AMBASSADOR, Raymond A. Hare,,Raymond,A.,Hare,,Raymond,Raymond Hare
DEPUTY CHIEF OF MISSION: Edwin W. Martin,DEPUTY CHIEF OF MISSION: Edwin W. Martin,DEPUTY CHIEF OF MISSION: Edwin W. Martin,DEPUTY CHIEF OF MISSION, Edwin W. Martin,,Edwin,W.,Martin,,Edwin,Edwin Martin
POLITICAL SECTION: Charles P. Clock,POLITICAL SECTION: Charles P. Clock,POLITICAL SECTION: Charles P. Clock,POLITICAL SECTION, Charles P. Clock,,Charles,P.,Clock,,Charles,Charles Clock
ECONOMIC SECTION: Randall S. Williams,ECONOMIC SECTION: Randall S. Williams,ECONOMIC SECTION: Randall S. Williams,ECONOMIC SECTION, Randall S. Williams,,Randall,S.,Williams,,Randall,Randall Williams
COUMERCIAL SECTION: Arthur U. i.llig,COUMERCIAL SECTION: Arthur U. i.llig,COUMERCIAL SECTION: Arthur U. i.llig,COUMERCIAL SECTION, Arthur U. i.llig,,Arthur,,U.,i.llig,Arthur,Arthur U.
