text,text_squish,text_joined,rank,name,title,first,middle,last,suffix,first_clean,firstlast
CONSUL GENERAL: Edward E. Rice,CONSUL GENERAL: Edward E. Rice,CONSUL GENERAL: Edward E. Rice,CONSUL GENERAL, Edward E. Rice,,Edward,E.,Rice,,Edward,Edward Rice
DEPUTY PRINCIPAL OFFICER: Oscar V. Armstrong,DEPUTY PRINCIPAL OFFICER: Oscar V. Armstrong,DEPUTY PRINCIPAL OFFICER: Oscar V. Armstrong,DEPUTY PRINCIPAL OFFICER, Oscar V. Armstrong,,Oscar,V.,Armstrong,,Oscar,Oscar Armstrong
ECONOMIC SECTION: Lynn H. Olson,ECONOMIC SECTION: Lynn H. Olson,ECONOMIC SECTION: Lynn H. Olson,ECONOMIC SECTION, Lynn H. Olson,,Lynn,H.,Olson,,Lynn,Lynn Olson
COMMERCIAL SECTION: Walter W. Sohl,COMMERCIAL SECTION: Walter W. Sohl,COMMERCIAL SECTION: Walter W. Sohl,COMMERCIAL SECTION, Walter W. Sohl,,Walter,W.,Sohl,,Walter,Walter Sohl
AGRICULTURAL OFFICER: John Reinhold Wenmohs,AGRICULTURAL OFFICER: John Reinhold Wenmohs,AGRICULTURAL OFFICER: John Reinhold Wenmohs,AGRICULTURAL OFFICER, John Reinhold Wenmohs,,John,Reinhold,Wenmohs,,John,John Wenmohs
LEGATION: Budapest,LEGATION: Budapest,LEGATION: Budapest,LEGATION, Budapest,,Budapest,,,,Budapest,Budapest 
DEPUTY CHIEF OF MISSION: Elim O'Shaughnessy,DEPUTY CHIEF OF MISSION: Elim O'Shaughnessy,DEPUTY CHIEF OF MISSION: Elim O'Shaughnessy,DEPUTY CHIEF OF MISSION, Elim O'Shaughnessy,,Elim,,O'Shaughnessy,,Elim,Elim O'Shaughnessy
POLITICAL SECTION: Richard W. Tims,POLITICAL SECTION: Richard W. Tims,POLITICAL SECTION: Richard W. Tims,POLITICAL SECTION, Richard W. Tims,,Richard,W.,Tims,,Richard,Richard Tims
ECONOMIC SECTION: Leopold Gotzlinger,ECONOMIC SECTION: Leopold Gotzlinger,ECONOMIC SECTION: Leopold Gotzlinger,ECONOMIC SECTION, Leopold Gotzlinger,,Leopold,,Gotzlinger,,Leopold,Leopold Gotzlinger
AMBASSADOR: James K. Penfield,AMBASSADOR: James K. Penfield,AMBASSADOR: James K. Penfield,AMBASSADOR, James K. Penfield,,James,K.,Penfield,,James,James Penfield
DEPUTY CHIEF OF MISSION: Valdemar N. L.,DEPUTY CHIEF OF MISSION: Valdemar N. L.,DEPUTY CHIEF OF MISSION: Valdemar N. L. Johnson,DEPUTY CHIEF OF MISSION, Valdemar N. L. Johnson,,Valdemar,N. L.,Johnson,,Valdemar,Valdemar Johnson
POLITICAL SECTION: John C. Brooks,POLITICAL SECTION: John C. Brooks,POLITICAL SECTION: John C. Brooks,POLITICAL SECTION, John C. Brooks,,John,C.,Brooks,,John,John Brooks
ECONOMIC SECTION: Geraldine B. Stibbe,ECONOMIC SECTION: Geraldine B. Stibbe,ECONOMIC SECTION: Geraldine B. Stibbe,ECONOMIC SECTION, Geraldine B. Stibbe,,Geraldine,B.,Stibbe,,Geraldine,Geraldine Stibbe
AMBASSADOR: Chester Bowles,AMBASSADOR: Chester Bowles,AMBASSADOR: Chester Bowles,AMBASSADOR, Chester Bowles,,Chester,,Bowles,,Chester,Chester Bowles
"DEPUTY CHIEF OF MISSION: Joseph N. Green, Jr.","DEPUTY CHIEF OF MISSION: Joseph N. Green, Jr.","DEPUTY CHIEF OF MISSION: Joseph N. Green, Jr.",DEPUTY CHIEF OF MISSION," Joseph N. Green, Jr.",,Joseph,N.,Green,Jr.,Joseph,Joseph Green
POLITICAL SECTION: L. Douglas Heck,POLITICAL SECTION: L. Douglas Heck,POLITICAL SECTION: L. Douglas Heck,POLITICAL SECTION, L. Douglas Heck,,L.,Douglas,Heck,,Douglas,Douglas Heck
ECONOMIC SECTION: Leonard Weiss,ECONOMIC SECTION: Leonard Weiss,ECONOMIC SECTION: Leonard Weiss,ECONOMIC SECTION, Leonard Weiss,,Leonard,,Weiss,,Leonard,Leonard Weiss
COMMERCIAL SECTION: James S. Lanigan,COMMERCIAL SECTION: James S. Lanigan,COMMERCIAL SECTION: James S. Lanigan,COMMERCIAL SECTION, James S. Lanigan,,James,S.,Lanigan,,James,James Lanigan
AGRICULTURAL ATTACHE: John H. Boulware,AGRICULTURAL ATTACHE: John H. Boulware,AGRICULTURAL ATTACHE: John H. Boulware,AGRICULTURAL ATTACHE, John H. Boulware,,John,H.,Boulware,,John,John Boulware
AID MISSION DIRECTOR: John P. Lewis,AID MISSION DIRECTOR: John P. Lewis,AID MISSION DIRECTOR: John P. Lewis,AID MISSION DIRECTOR, John P. Lewis,,John,P.,Lewis,,John,John Lewis
CONSULATE GENERAL: Bombay,CONSULATE GENERAL: Bombay,CONSULATE GENERAL: Bombay,CONSULATE GENERAL, Bombay,,Bombay,,,,Bombay,Bombay 
CONSUL GENERAL: Milton C. Rewinkel,CONSUL GENERAL: Milton C. Rewinkel,CONSUL GENERAL: Milton C. Rewinkel,CONSUL GENERAL, Milton C. Rewinkel,,Milton,C.,Rewinkel,,Milton,Milton Rewinkel
ECONOMIC SECTION: Jack C. Miklos,ECONOMIC SECTION: Jack C. Miklos,ECONOMIC SECTION: Jack C. Miklos,ECONOMIC SECTION, Jack C. Miklos,,Jack,C.,Miklos,,Jack,Jack Miklos
COMMERCIAL SECTION: William J. Drew,COMMERCIAL SECTION: William J. Drew,COMMERCIAL SECTION: William J. Drew,COMMERCIAL SECTION, William J. Drew,,William,J.,Drew,,William,William Drew
AGRICULTURAL OFFICER: Robert B. Evans,AGRICULTURAL OFFICER: Robert B. Evans,AGRICULTURAL OFFICER: Robert B. Evans,AGRICULTURAL OFFICER, Robert B. Evans,,Robert,B.,Evans,,Robert,Robert Evans
CONSULATE GENERAL: Calcutta,CONSULATE GENERAL: Calcutta,CONSULATE GENERAL: Calcutta,CONSULATE GENERAL, Calcutta,,Calcutta,,,,Calcutta,Calcutta 
CONSUL GENERAL: William K. Hitchcock,CONSUL GENERAL: William K. Hitchcock,CONSUL GENERAL: William K. Hitchcock,CONSUL GENERAL, William K. Hitchcock,,William,K.,Hitchcock,,William,William Hitchcock
"ECONOMIC SECTION: Alfred L. Atherton, Jr.","ECONOMIC SECTION: Alfred L. Atherton, Jr.","ECONOMIC SECTION: Alfred L. Atherton, Jr.",ECONOMIC SECTION," Alfred L. Atherton, Jr.",,Alfred,L.,Atherton,Jr.,Alfred,Alfred Atherton
COMMERCIAL SECTION: Joseph C. Wilson,COMMERCIAL SECTION: Joseph C. Wilson,COMMERCIAL SECTION: Joseph C. Wilson,COMMERCIAL SECTION, Joseph C. Wilson,,Joseph,C.,Wilson,,Joseph,Joseph Wilson
CONSULATE GENERAL: Madras,CONSULATE GENERAL: Madras,CONSULATE GENERAL: Madras,CONSULATE GENERAL, Madras,,Madras,,,,Madras,Madras 
CONSUL GENERAL: Albert B. Franklin,CONSUL GENERAL: Albert B. Franklin,CONSUL GENERAL: Albert B. Franklin,CONSUL GENERAL, Albert B. Franklin,,Albert,B.,Franklin,,Albert,Albert Franklin
ECONOMIC SECTION: William C. Nenno,ECONOMIC SECTION: William C. Nenno,ECONOMIC SECTION: William C. Nenno,ECONOMIC SECTION, William C. Nenno,,William,C.,Nenno,,William,William Nenno
COMMERCIAL SECTION: Richard N. Viets,COMMERCIAL SECTION: Richard N. Viets,COMMERCIAL SECTION: Richard N. Viets,COMMERCIAL SECTION, Richard N. Viets,,Richard,N.,Viets,,Richard,Richard Viets
AMBASSADOR: Howard P. Jones,AMBASSADOR: Howard P. Jones,AMBASSADOR: Howard P. Jones,AMBASSADOR, Howard P. Jones,,Howard,P.,Jones,,Howard,Howard Jones
DEPUTY CHIEF OF MISSION: Francis J. Galbraith,DEPUTY CHIEF OF MISSION: Francis J. Galbraith,DEPUTY CHIEF OF MISSION: Francis J. Galbraith,DEPUTY CHIEF OF MISSION, Francis J. Galbraith,,Francis,J.,Galbraith,,Francis,Francis Galbraith
POLITICAL SECTION: Edward C. Masters,POLITICAL SECTION: Edward C. Masters,POLITICAL SECTION: Edward C. Masters,POLITICAL SECTION, Edward C. Masters,,Edward,C.,Masters,,Edward,Edward Masters
ECONOMIC SECTION: Perry Ellis,ECONOMIC SECTION: Perry Ellis,ECONOMIC SECTION: Perry Ellis,ECONOMIC SECTION, Perry Ellis,,Perry,,Ellis,,Perry,Perry Ellis
COMMERCIAL SECTION: Paul D. McCusker,COMMERCIAL SECTION: Paul D. McCusker,COMMERCIAL SECTION: Paul D. McCusker,COMMERCIAL SECTION, Paul D. McCusker,,Paul,D.,McCusker,,Paul,Paul McCusker
AGRICULTURAL ATTACHE: Carl 0. Winberg,AGRICULTURAL ATTACHE: Carl 0. Winberg,AGRICULTURAL ATTACHE: Carl 0. Winberg,AGRICULTURAL ATTACHE, Carl 0. Winberg,,Carl,0.,Winberg,,Carl,Carl Winberg
AID MISSION DIRECTOR: J. Howard Edwards,AID MISSION DIRECTOR: J. Howard Edwards,AID MISSION DIRECTOR: J. Howard Edwards,AID MISSION DIRECTOR, J. Howard Edwards,,J.,Howard,Edwards,,Howard,Howard Edwards
AMBASSADOR: Julius C. Holmes,AMBASSADOR: Julius C. Holmes,AMBASSADOR: Julius C. Holmes,AMBASSADOR, Julius C. Holmes,,Julius,C.,Holmes,,Julius,Julius Holmes
DEPUTY CHIEF OF MISSION: Stuart W. Rockwell,DEPUTY CHIEF OF MISSION: Stuart W. Rockwell,DEPUTY CHIEF OF MISSION: Stuart W. Rockwell,DEPUTY CHIEF OF MISSION, Stuart W. Rockwell,,Stuart,W.,Rockwell,,Stuart,Stuart Rockwell
POLITICAL SECTION: Martin F. Herz,POLITICAL SECTION: Martin F. Herz,POLITICAL SECTION: Martin F. Herz,POLITICAL SECTION, Martin F. Herz,,Martin,F.,Herz,,Martin,Martin Herz
ECONOMIC SECTION: James W. Swihart,ECONOMIC SECTION: James W. Swihart,ECONOMIC SECTION: James W. Swihart,ECONOMIC SECTION, James W. Swihart,,James,W.,Swihart,,James,James Swihart
COMMERICAL SECTION: John K. Hagemann,COMMERICAL SECTION: John K. Hagemann,COMMERICAL SECTION: John K. Hagemann,COMMERICAL SECTION, John K. Hagemann,,John,K.,Hagemann,,John,John Hagemann
AGRICULTURAL ATTACHE: Tilmer O. Engerbretson,AGRICULTURAL ATTACHE: Tilmer O. Engerbretson,AGRICULTURAL ATTACHE: Tilmer O. Engerbretson,AGRICULTURAL ATTACHE, Tilmer O. Engerbretson,,Tilmer,O.,Engerbretson,,Tilmer,Tilmer Engerbretson
AID MISSION DIRECTOR: Howard L. Parsons,AID MISSION DIRECTOR: Howard L. Parsons,AID MISSION DIRECTOR: Howard L. Parsons,AID MISSION DIRECTOR, Howard L. Parsons,,Howard,L.,Parsons,,Howard,Howard Parsons
AMBASSADOR: Robert C. Strong,AMBASSADOR: Robert C. Strong,AMBASSADOR: Robert C. Strong,AMBASSADOR, Robert C. Strong,,Robert,C.,Strong,,Robert,Robert Strong
"DEPUTY CHIEF OF MISSION: J. Wesley Adams, Jr.","DEPUTY CHIEF OF MISSION: J. Wesley Adams, Jr.","DEPUTY CHIEF OF MISSION: J. Wesley Adams, Jr.",DEPUTY CHIEF OF MISSION," J. Wesley Adams, Jr.",,J.,Wesley,Adams,Jr.,Wesley,Wesley Adams
POLITICAL SECTION: James E. Akins,POLITICAL SECTION: James E. Akins,POLITICAL SECTION: James E. Akins,POLITICAL SECTION, James E. Akins,,James,E.,Akins,,James,James Akins
ECONOMIC SECTION: Rupert Prohme,ECONOMIC SECTION: Rupert Prohme,ECONOMIC SECTION: Rupert Prohme,ECONOMIC SECTION, Rupert Prohme,,Rupert,,Prohme,,Rupert,Rupert Prohme
COMMERCIAL SECTION: Joe Lill,COMMERCIAL SECTION: Joe Lill,COMMERCIAL SECTION: Joe Lill,COMMERCIAL SECTION, Joe Lill,,Joe,,Lill,,Joe,Joe Lill
DEPUTY CHIEF OF MISSION: Robert P. Chalker,DEPUTY CHIEF OF MISSION: Robert P. Chalker,DEPUTY CHIEF OF MISSION: Robert P. Chalker,DEPUTY CHIEF OF MISSION, Robert P. Chalker,,Robert,P.,Chalker,,Robert,Robert Chalker
POLITICAL SECTION: Irving G. Cheslaw,POLITICAL SECTION: Irving G. Cheslaw,POLITICAL SECTION: Irving G. Cheslaw,POLITICAL SECTION, Irving G. Cheslaw,,Irving,G.,Cheslaw,,Irving,Irving Cheslaw
ECONOMIC SECTION: Edward R. O'Connor,ECONOMIC SECTION: Edward R. O'Connor,ECONOMIC SECTION: Edward R. O'Connor,ECONOMIC SECTION, Edward R. O'Connor,,Edward,R.,O'Connor,,Edward,Edward O'Connor
AGRICULTURAL ATTACHE: Charalambos S.,AGRICULTURAL ATTACHE: Charalambos S.,AGRICULTURAL ATTACHE: Charalambos S. Stephanides,AGRICULTURAL ATTACHE, Charalambos S. Stephanides,,Charalambos,S.,Stephanides,,Charalambos,Charalambos Stephanides
AMBASSADOR: Walworth Barbour,AMBASSADOR: Walworth Barbour,AMBASSADOR: Walworth Barbour,AMBASSADOR, Walworth Barbour,,Walworth,,Barbour,,Walworth,Walworth Barbour
DEPUTY CHIEF OF MISSION: William N. Dale,DEPUTY CHIEF OF MISSION: William N. Dale,DEPUTY CHIEF OF MISSION: William N. Dale,DEPUTY CHIEF OF MISSION, William N. Dale,,William,N.,Dale,,William,William Dale
"POLITICAL SECTION: Stephen E. Palmer, Jr.","POLITICAL SECTION: Stephen E. Palmer, Jr.","POLITICAL SECTION: Stephen E. Palmer, Jr.",POLITICAL SECTION," Stephen E. Palmer, Jr.",,Stephen,E.,Palmer,Jr.,Stephen,Stephen Palmer
ECONOMIC SECTION: William M. Kerrigan,ECONOMIC SECTION: William M. Kerrigan,ECONOMIC SECTION: William M. Kerrigan,ECONOMIC SECTION, William M. Kerrigan,,William,M.,Kerrigan,,William,William Kerrigan
AGRICULTURAL ATTACHE: Voldrus H. Hougen,AGRICULTURAL ATTACHE: Voldrus H. Hougen,AGRICULTURAL ATTACHE: Voldrus H. Hougen,AGRICULTURAL ATTACHE, Voldrus H. Hougen,,Voldrus,H.,Hougen,,Voldrus,Voldrus Hougen
AMBASSADOR: G. Frederick Reinhardt,AMBASSADOR: G. Frederick Reinhardt,AMBASSADOR: G. Frederick Reinhardt,AMBASSADOR, G. Frederick Reinhardt,,G.,Frederick,Reinhardt,,Frederick,Frederick Reinhardt
"DEPUTY CHIEF OF MISSION: Francis E. Meloy, Jr.","DEPUTY CHIEF OF MISSION: Francis E. Meloy, Jr.","DEPUTY CHIEF OF MISSION: Francis E. Meloy, Jr.",DEPUTY CHIEF OF MISSION," Francis E. Meloy, Jr.",,Francis,E.,Meloy,Jr.,Francis,Francis Meloy
POLITICAL SECTION: William N. Fraleigh,POLITICAL SECTION: William N. Fraleigh,POLITICAL SECTION: William N. Fraleigh,POLITICAL SECTION, William N. Fraleigh,,William,N.,Fraleigh,,William,William Fraleigh
ECONOMIC SECTION: Sydney L. W. Mellen,ECONOMIC SECTION: Sydney L. W. Mellen,ECONOMIC SECTION: Sydney L. W. Mellen,ECONOMIC SECTION, Sydney L. W. Mellen,,Sydney,L. W.,Mellen,,Sydney,Sydney Mellen
COMMERCIAL SECTION: Theodore J. Hadraba,COMMERCIAL SECTION: Theodore J. Hadraba,COMMERCIAL SECTION: Theodore J. Hadraba,COMMERCIAL SECTION, Theodore J. Hadraba,,Theodore,J.,Hadraba,,Theodore,Theodore Hadraba
AGRICULTURAL ATTACHE: Robert C. Tetro,AGRICULTURAL ATTACHE: Robert C. Tetro,AGRICULTURAL ATTACHE: Robert C. Tetro,AGRICULTURAL ATTACHE, Robert C. Tetro,,Robert,C.,Tetro,,Robert,Robert Tetro
CONSULATE GENERAL: Genoa,CONSULATE GENERAL: Genoa,CONSULATE GENERAL: Genoa,CONSULATE GENERAL, Genoa,,Genoa,,,,Genoa,Genoa 
CONSUL GENERAL: Millan L. Egert,CONSUL GENERAL: Millan L. Egert,CONSUL GENERAL: Millan L. Egert,CONSUL GENERAL, Millan L. Egert,,Millan,L.,Egert,,Millan,Millan Egert
ECONOMIC SECTION: Charles H. Pletcher,ECONOMIC SECTION: Charles H. Pletcher,ECONOMIC SECTION: Charles H. Pletcher,ECONOMIC SECTION, Charles H. Pletcher,,Charles,H.,Pletcher,,Charles,Charles Pletcher
CONSULATE GENERAL: Milan,CONSULATE GENERAL: Milan,CONSULATE GENERAL: Milan,CONSULATE GENERAL, Milan,,Milan,,,,Milan,Milan 
CONSUL GENERAL: Earl T. Crain,CONSUL GENERAL: Earl T. Crain,CONSUL GENERAL: Earl T. Crain,CONSUL GENERAL, Earl T. Crain,,Earl,T.,Crain,,Earl,Earl Crain
"ECONOMIC SECTION: C. Melvin Sonne, Jr.","ECONOMIC SECTION: C. Melvin Sonne, Jr.","ECONOMIC SECTION: C. Melvin Sonne, Jr.",ECONOMIC SECTION," C. Melvin Sonne, Jr.",,C.,Melvin,Sonne,Jr.,Melvin,Melvin Sonne
COMMERCIAL SECTION: Amaldo Berenguer,COMMERCIAL SECTION: Amaldo Berenguer,COMMERCIAL SECTION: Amaldo Berenguer,COMMERCIAL SECTION, Amaldo Berenguer,,Amaldo,,Berenguer,,Amaldo,Amaldo Berenguer
US TRADE CENTER: Martin Stahl,US TRADE CENTER: Martin Stahl,US TRADE CENTER: Martin Stahl,US TRADE CENTER, Martin Stahl,,Martin,,Stahl,,Martin,Martin Stahl
CONSULATE GENERAL: Naples,CONSULATE GENERAL: Naples,CONSULATE GENERAL: Naples,CONSULATE GENERAL, Naples,,Naples,,,,Naples,Naples 
"CONSUL GENERAL: Homer M. Byington, Jr.","CONSUL GENERAL: Homer M. Byington, Jr.","CONSUL GENERAL: Homer M. Byington, Jr.",CONSUL GENERAL," Homer M. Byington, Jr.",,Homer,M.,Byington,Jr.,Homer,Homer Byington
DEPUTY PRINCIPAL OFFICER: Alfred P. Dennis,DEPUTY PRINCIPAL OFFICER: Alfred P. Dennis,DEPUTY PRINCIPAL OFFICER: Alfred P. Dennis,DEPUTY PRINCIPAL OFFICER, Alfred P. Dennis,,Alfred,P.,Dennis,,Alfred,Alfred Dennis
CONSULATE GENERAL: Palermo,CONSULATE GENERAL: Palermo,CONSULATE GENERAL: Palermo,CONSULATE GENERAL, Palermo,,Palermo,,,,Palermo,Palermo 
CONSUL GENERAL: John Ordway,CONSUL GENERAL: John Ordway,CONSUL GENERAL: John Ordway,CONSUL GENERAL, John Ordway,,John,,Ordway,,John,John Ordway
ECONOMIC SECTION: Charles R. Stout,ECONOMIC SECTION: Charles R. Stout,ECONOMIC SECTION: Charles R. Stout,ECONOMIC SECTION, Charles R. Stout,,Charles,R.,Stout,,Charles,Charles Stout
AMBASSADOR: James Wine,AMBASSADOR: James Wine,AMBASSADOR: James Wine,AMBASSADOR, James Wine,,James,,Wine,,James,James Wine
DEPUTY CHIEF OF MISSION: Leslie L. Rood,DEPUTY CHIEF OF MISSION: Leslie L. Rood,DEPUTY CHIEF OF MISSION: Leslie L. Rood,DEPUTY CHIEF OF MISSION, Leslie L. Rood,,Leslie,L.,Rood,,Leslie,Leslie Rood
POLITICAL SECTION: William B. Young,POLITICAL SECTION: William B. Young,POLITICAL SECTION: William B. Young,POLITICAL SECTION, William B. Young,,William,B.,Young,,William,William Young
ECONOMIC SECTION: Robert B. Oakley,ECONOMIC SECTION: Robert B. Oakley,ECONOMIC SECTION: Robert B. Oakley,ECONOMIC SECTION, Robert B. Oakley,,Robert,B.,Oakley,,Robert,Robert Oakley
COMMERCIAL SECTION: G. Michael Bache,COMMERCIAL SECTION: G. Michael Bache,COMMERCIAL SECTION: G. Michael Bache,COMMERCIAL SECTION, G. Michael Bache,,G.,Michael,Bache,,Michael,Michael Bache
DEPUTY CHIEF OF MISSION: Boris H. Klosson,DEPUTY CHIEF OF MISSION: Boris H. Klosson,DEPUTY CHIEF OF MISSION: Boris H. Klosson,DEPUTY CHIEF OF MISSION, Boris H. Klosson,,Boris,H.,Klosson,,Boris,Boris Klosson
POLITICAL SECTION: William B. Grant,POLITICAL SECTION: William B. Grant,POLITICAL SECTION: William B. Grant,POLITICAL SECTION, William B. Grant,,William,B.,Grant,,William,William Grant
ECONOMIC SECTION: Robert E. Rosselot,ECONOMIC SECTION: Robert E. Rosselot,ECONOMIC SECTION: Robert E. Rosselot,ECONOMIC SECTION, Robert E. Rosselot,,Robert,E.,Rosselot,,Robert,Robert Rosselot
COMMERCIAL SECTION: Thomas J. Scanlon,COMMERCIAL SECTION: Thomas J. Scanlon,COMMERCIAL SECTION: Thomas J. Scanlon,COMMERCIAL SECTION, Thomas J. Scanlon,,Thomas,J.,Scanlon,,Thomas,Thomas Scanlon
AMBASSADOR: Edwin O. Reischauer,AMBASSADOR: Edwin O. Reischauer,AMBASSADOR: Edwin O. Reischauer,AMBASSADOR, Edwin O. Reischauer,,Edwin,O.,Reischauer,,Edwin,Edwin Reischauer
DEPUTY CHIEF OF MISSION: John K. Emmerson,DEPUTY CHIEF OF MISSION: John K. Emmerson,DEPUTY CHIEF OF MISSION: John K. Emmerson,DEPUTY CHIEF OF MISSION, John K. Emmerson,,John,K.,Emmerson,,John,John Emmerson
"POLITICAL SECTION: J. Owen Zurhellen, Jr.","POLITICAL SECTION: J. Owen Zurhellen, Jr.","POLITICAL SECTION: J. Owen Zurhellen, Jr.",POLITICAL SECTION," J. Owen Zurhellen, Jr.",,J.,Owen,Zurhellen,Jr.,Owen,Owen Zurhellen
ECONOMIC SECTION: Lawrence C. Vass,ECONOMIC SECTION: Lawrence C. Vass,ECONOMIC SECTION: Lawrence C. Vass,ECONOMIC SECTION, Lawrence C. Vass,,Lawrence,C.,Vass,,Lawrence,Lawrence Vass
"COMMERCIAL SECTION: Carney G. Laslie, Jr.","COMMERCIAL SECTION: Carney G. Laslie, Jr.","COMMERCIAL SECTION: Carney G. Laslie, Jr.",COMMERCIAL SECTION," Carney G. Laslie, Jr.",,Carney,G.,Laslie,Jr.,Carney,Carney Laslie
AGRICULTURAL ATTACHE: Joseph C. Dodson,AGRICULTURAL ATTACHE: Joseph C. Dodson,AGRICULTURAL ATTACHE: Joseph C. Dodson,AGRICULTURAL ATTACHE, Joseph C. Dodson,,Joseph,C.,Dodson,,Joseph,Joseph Dodson
CONSULATE GENERAL: Kobe.Osako,CONSULATE GENERAL: Kobe.Osako,CONSULATE GENERAL: Kobe.Osako,CONSULATE GENERAL, Kobe.Osako,,Kobe.Osako,,,,Kobe.Osako,Kobe.Osako 
CONSUL GENERAL: John L. Stegmaier,CONSUL GENERAL: John L. Stegmaier,CONSUL GENERAL: John L. Stegmaier,CONSUL GENERAL, John L. Stegmaier,,John,L.,Stegmaier,,John,John Stegmaier
ECONOMIC SECTION: Philip E. Haring,ECONOMIC SECTION: Philip E. Haring,ECONOMIC SECTION: Philip E. Haring,ECONOMIC SECTION, Philip E. Haring,,Philip,E.,Haring,,Philip,Philip Haring
COMMERCIAL SECTION: Raymond W. Eiselt,COMMERCIAL SECTION: Raymond W. Eiselt,COMMERCIAL SECTION: Raymond W. Eiselt,COMMERCIAL SECTION, Raymond W. Eiselt,,Raymond,W.,Eiselt,,Raymond,Raymond Eiselt
CONSULATE GENERAL: Jerusalem,CONSULATE GENERAL: Jerusalem,CONSULATE GENERAL: Jerusalem,CONSULATE GENERAL, Jerusalem,,Jerusalem,,,,Jerusalem,Jerusalem 
CONSUL GENERAL: Evan M. Wilson,CONSUL GENERAL: Evan M. Wilson,CONSUL GENERAL: Evan M. Wilson,CONSUL GENERAL, Evan M. Wilson,,Evan,M.,Wilson,,Evan,Evan Wilson
ECONOMIC SECTION: Joyce R. Hermann,ECONOMIC SECTION: Joyce R. Hermann,ECONOMIC SECTION: Joyce R. Hermann,ECONOMIC SECTION, Joyce R. Hermann,,Joyce,R.,Hermann,,Joyce,Joyce Hermann
AMBASSADOR: Robert G. Barnes,AMBASSADOR: Robert G. Barnes,AMBASSADOR: Robert G. Barnes,AMBASSADOR, Robert G. Barnes,,Robert,G.,Barnes,,Robert,Robert Barnes
DEPUTY CHIEF OF MISSION: Geoffrey W. Lewis,DEPUTY CHIEF OF MISSION: Geoffrey W. Lewis,DEPUTY CHIEF OF MISSION: Geoffrey W. Lewis,DEPUTY CHIEF OF MISSION, Geoffrey W. Lewis,,Geoffrey,W.,Lewis,,Geoffrey,Geoffrey Lewis
POLITICAL SECTION: Gabriel J. Paolozzi,POLITICAL SECTION: Gabriel J. Paolozzi,POLITICAL SECTION: Gabriel J. Paolozzi,POLITICAL SECTION, Gabriel J. Paolozzi,,Gabriel,J.,Paolozzi,,Gabriel,Gabriel Paolozzi
ECONOMIC SECTION: Donald B. Calder,ECONOMIC SECTION: Donald B. Calder,ECONOMIC SECTION: Donald B. Calder,ECONOMIC SECTION, Donald B. Calder,,Donald,B.,Calder,,Donald,Donald Calder
AGRICULTURAL ATTACHE: Donald L. MacDonald,AGRICULTURAL ATTACHE: Donald L. MacDonald,AGRICULTURAL ATTACHE: Donald L. MacDonald,AGRICULTURAL ATTACHE, Donald L. MacDonald,,Donald,L.,MacDonald,,Donald,Donald MacDonald
AID MISSION DIRECTOR: Russell S. McClure,AID MISSION DIRECTOR: Russell S. McClure,AID MISSION DIRECTOR: Russell S. McClure,AID MISSION DIRECTOR, Russell S. McClure,,Russell,S.,McClure,,Russell,Russell McClure
AMBASSADOR: William Attwood,AMBASSADOR: William Attwood,AMBASSADOR: William Attwood,AMBASSADOR, William Attwood,,William,,Attwood,,William,William Attwood
DEPUTY CHIEF OF MISSION: James R. Ruchti,DEPUTY CHIEF OF MISSION: James R. Ruchti,DEPUTY CHIEF OF MISSION: James R. Ruchti,DEPUTY CHIEF OF MISSION, James R. Ruchti,,James,R.,Ruchti,,James,James Ruchti
POLITICAL SECTION: Philip A. Heller,POLITICAL SECTION: Philip A. Heller,POLITICAL SECTION: Philip A. Heller,POLITICAL SECTION, Philip A. Heller,,Philip,A.,Heller,,Philip,Philip Heller
ECONOMIC SECTION: Morris Dembo,ECONOMIC SECTION: Morris Dembo,ECONOMIC SECTION: Morris Dembo,ECONOMIC SECTION, Morris Dembo,,Morris,,Dembo,,Morris,Morris Dembo
"COMMERCIAL SECTION: Robert L. Ware, Jr.","COMMERCIAL SECTION: Robert L. Ware, Jr.","COMMERCIAL SECTION: Robert L. Ware, Jr.",COMMERCIAL SECTION," Robert L. Ware, Jr.",,Robert,L.,Ware,Jr.,Robert,Robert Ware
AGRICULTURAL ATTACHE: William R. Hatch,AGRICULTURAL ATTACHE: William R. Hatch,AGRICULTURAL ATTACHE: William R. Hatch,AGRICULTURAL ATTACHE, William R. Hatch,,William,R.,Hatch,,William,William Hatch
"AID MISSION DIRECTOR: William C. Wild, Jr.","AID MISSION DIRECTOR: William C. Wild, Jr.","AID MISSION DIRECTOR: William C. Wild, Jr.",AID MISSION DIRECTOR," William C. Wild, Jr.",,William,C.,Wild,Jr.,William,William Wild
AMBASSADOR: Winthrop G. Brown,AMBASSADOR: Winthrop G. Brown,AMBASSADOR: Winthrop G. Brown,AMBASSADOR, Winthrop G. Brown,,Winthrop,G.,Brown,,Winthrop,Winthrop Brown
DEPUTY CHIEF OF MISSION: Edward W. Doherty,DEPUTY CHIEF OF MISSION: Edward W. Doherty,DEPUTY CHIEF OF MISSION: Edward W. Doherty,DEPUTY CHIEF OF MISSION, Edward W. Doherty,,Edward,W.,Doherty,,Edward,Edward Doherty
POLITICAL SECTION: Philip C. Habib,POLITICAL SECTION: Philip C. Habib,POLITICAL SECTION: Philip C. Habib,POLITICAL SECTION, Philip C. Habib,,Philip,C.,Habib,,Philip,Philip Habib
ECONOMIC SECTION: Floyd L. Whittington,ECONOMIC SECTION: Floyd L. Whittington,ECONOMIC SECTION: Floyd L. Whittington,ECONOMIC SECTION, Floyd L. Whittington,,Floyd,L.,Whittington,,Floyd,Floyd Whittington
COMMERCIAL SECTION: G.E. Robert Meyer,COMMERCIAL SECTION: G.E. Robert Meyer,COMMERCIAL SECTION: G.E. Robert Meyer,COMMERCIAL SECTION, G.E. Robert Meyer,,G.E.,Robert,Meyer,,Robert,Robert Meyer
AID MISSION DIRECTOR: Joel Bernstein,AID MISSION DIRECTOR: Joel Bernstein,AID MISSION DIRECTOR: Joel Bernstein,AID MISSION DIRECTOR, Joel Bernstein,,Joel,,Bernstein,,Joel,Joel Bernstein
AMBASSADOR: Howard R. Cottam,AMBASSADOR: Howard R. Cottam,AMBASSADOR: Howard R. Cottam,AMBASSADOR, Howard R. Cottam,,Howard,R.,Cottam,,Howard,Howard Cottam
"DEPUTY CHIEF OF MISSION: John N. Gatch, Jr.","DEPUTY CHIEF OF MISSION: John N. Gatch, Jr.","DEPUTY CHIEF OF MISSION: John N. Gatch, Jr.",DEPUTY CHIEF OF MISSION," John N. Gatch, Jr.",,John,N.,Gatch,Jr.,John,John Gatch
ECONOMIC SECTION: Joseph W. Twinam,ECONOMIC SECTION: Joseph W. Twinam,ECONOMIC SECTION: Joseph W. Twinam,ECONOMIC SECTION, Joseph W. Twinam,,Joseph,W.,Twinam,,Joseph,Joseph Twinam
AMBASSADOR: William H. Sullivan,AMBASSADOR: William H. Sullivan,AMBASSADOR: William H. Sullivan,AMBASSADOR, William H. Sullivan,,William,H.,Sullivan,,William,William Sullivan
DEPUTY CHIEF OF MISSION: Emory C. SwanK,DEPUTY CHIEF OF MISSION: Emory C. SwanK,DEPUTY CHIEF OF MISSION: Emory C. SwanK,DEPUTY CHIEF OF MISSION, Emory C. SwanK,,Emory,C.,SwanK,,Emory,Emory SwanK
POLITICAL SECTION: William A. Chapin,POLITICAL SECTION: William A. Chapin,POLITICAL SECTION: William A. Chapin,POLITICAL SECTION, William A. Chapin,,William,A.,Chapin,,William,William Chapin
ECONOMIC SECTION: Edward J. Thrasher,ECONOMIC SECTION: Edward J. Thrasher,ECONOMIC SECTION: Edward J. Thrasher,ECONOMIC SECTION, Edward J. Thrasher,,Edward,J.,Thrasher,,Edward,Edward Thrasher
AMBASSADOR: Armin H. Meyer,AMBASSADOR: Armin H. Meyer,AMBASSADOR: Armin H. Meyer,AMBASSADOR, Armin H. Meyer,,Armin,H.,Meyer,,Armin,Armin Meyer
DEPUTY CHIEF OF MISSION: Adrian T. Middleton,DEPUTY CHIEF OF MISSION: Adrian T. Middleton,DEPUTY CHIEF OF MISSION: Adrian T. Middleton,DEPUTY CHIEF OF MISSION, Adrian T. Middleton,,Adrian,T.,Middleton,,Adrian,Adrian Middleton
POLITICAL SECTION: Dayton S. Mak,POLITICAL SECTION: Dayton S. Mak,POLITICAL SECTION: Dayton S. Mak,POLITICAL SECTION, Dayton S. Mak,,Dayton,S.,Mak,,Dayton,Dayton Mak
ECONOMIC SECTION: Leslie C. Tihany,ECONOMIC SECTION: Leslie C. Tihany,ECONOMIC SECTION: Leslie C. Tihany,ECONOMIC SECTION, Leslie C. Tihany,,Leslie,C.,Tihany,,Leslie,Leslie Tihany
COMMERCIAL SECTION: John C. Weisert,COMMERCIAL SECTION: John C. Weisert,COMMERCIAL SECTION: John C. Weisert,COMMERCIAL SECTION, John C. Weisert,,John,C.,Weisert,,John,John Weisert
AMBASSADOR: Ben H. Brown,AMBASSADOR: Ben H. Brown,AMBASSADOR: Ben H. Brown,AMBASSADOR, Ben H. Brown,,Ben,H.,Brown,,Ben,Ben Brown
DEPUTY CHIEF OF MISSION: Russell L. Riley,DEPUTY CHIEF OF MISSION: Russell L. Riley,DEPUTY CHIEF OF MISSION: Russell L. Riley,DEPUTY CHIEF OF MISSION, Russell L. Riley,,Russell,L.,Riley,,Russell,Russell Riley
POLITICAL SECTION: E. Jan Nadelman,POLITICAL SECTION: E. Jan Nadelman,POLITICAL SECTION: E. Jan Nadelman,POLITICAL SECTION, E. Jan Nadelman,,E.,Jan,Nadelman,,Jan,Jan Nadelman
ECONOMIC SECTION: Vernon L. Merrill,ECONOMIC SECTION: Vernon L. Merrill,ECONOMIC SECTION: Vernon L. Merrill,ECONOMIC SECTION, Vernon L. Merrill,,Vernon,L.,Merrill,,Vernon,Vernon Merrill
COMMERCIAL SECTION: Nancy V. Rawls,COMMERCIAL SECTION: Nancy V. Rawls,COMMERCIAL SECTION: Nancy V. Rawls,COMMERCIAL SECTION, Nancy V. Rawls,,Nancy,V.,Rawls,,Nancy,Nancy Rawls
AID MISSION DIRECTOR: Robert H. Nooter,AID MISSION DIRECTOR: Robert H. Nooter,AID MISSION DIRECTOR: Robert H. Nooter,AID MISSION DIRECTOR, Robert H. Nooter,,Robert,H.,Nooter,,Robert,Robert Nooter
